review_id,product_id,customer_id,rating,review_text,review_date
2246,8782,1498,3,Drug family spend suggest pay them.,2025-02-18 18:30:47.771662
2247,7602,4844,3,Different matter professional listen condition.,2025-02-02 00:38:28.642745
2248,6514,4204,3,Night begin serious follow never.,2025-01-04 16:34:25.775377
2249,15398,1498,4,Economic seek as fly.,2025-01-20 01:37:43.086816
2250,19649,3129,2,Term resource before together catch travel.,2025-01-18 03:24:58.243004
2251,11263,469,4,Newspaper less wind response.,2025-02-28 22:03:56.021848
2252,14025,1944,4,Away take born bit enjoy relationship work walk.,2025-04-03 20:14:35.602985
2253,15470,162,1,Hour audience more politics.,2025-01-16 12:53:28.042579
2254,11280,989,3,Newspaper world again these national across seat city.,2025-03-13 01:46:10.726528
2255,16510,4739,2,Which change sell ahead.,2025-01-29 03:19:19.932548
2256,10134,618,5,Chance expert power particular source.,2025-03-10 12:30:43.146304
2257,6790,2565,4,Information million lawyer despite hair.,2025-04-18 09:16:04.970001
2258,7081,543,2,Project establish down night.,2025-02-08 05:59:10.466665
2259,13399,953,3,Message since heavy civil also challenge.,2025-01-06 13:16:45.453881
2260,11316,1339,2,Plan as nation up company.,2025-04-10 11:56:18.989610
2261,8994,658,4,Indicate bed card soon account after letter into.,2025-02-26 04:02:51.990977
2262,13897,4866,1,Early threat if source.,2025-03-31 02:26:42.049348
2263,4379,39,5,Fill finally guess.,2025-03-31 13:13:33.751058
2264,1465,2631,3,Kitchen including thought him run road.,2025-02-15 00:56:03.713246
2265,11026,2382,4,Every possible much.,2025-01-26 17:51:12.137044
2266,10316,4167,4,Include position mind some animal.,2025-05-05 10:56:47.003356
2267,16675,128,3,Husband condition evening need.,2025-01-31 18:54:12.301946
2268,10788,3715,4,By perhaps road in.,2025-03-06 09:28:06.780848
2269,14524,2401,1,Attention thousand kind recently.,2025-01-08 22:34:32.274286
2270,1566,2511,1,Add trade almost culture forget inside.,2025-01-25 13:28:10.609053
2271,44,2487,2,Little theory pretty stage risk cut data.,2025-04-17 04:24:54.514959
2272,17100,2233,4,Common nothing back message idea administration action.,2025-02-28 04:54:10.297734
2273,17335,3654,1,Later view fall control realize that partner break.,2025-05-15 12:02:03.379145
2274,12359,4711,4,Occur bar employee avoid.,2025-01-21 10:39:04.034870
2275,11764,3067,1,Room statement woman grow until get.,2025-02-03 20:07:57.696724
2276,807,2962,5,Throw onto class century number.,2025-04-08 14:11:47.128767
2277,5757,1086,5,Actually would behind teach side whom somebody.,2025-02-17 01:37:20.296585
2278,11758,2050,1,Official where religious visit.,2025-01-19 10:51:31.639867
2279,15030,875,2,Election floor information close box.,2025-01-22 00:22:15.822907
2280,19229,2804,3,As seven game trip suddenly to expert man.,2025-01-17 02:18:45.454862
2281,5525,30,3,Season scene per in movie.,2025-03-28 19:20:28.245458
2282,9934,55,4,Response car clear front himself.,2025-02-19 01:56:47.275196
2283,9522,337,5,White least place identify central skill become film.,2025-01-26 19:29:32.442738
2284,7191,2001,3,Boy of vote college.,2025-01-16 15:13:13.705771
2285,16512,1128,1,Improve require help possible fine save.,2025-04-13 21:46:05.677453
2286,14397,1243,2,Later avoid former yeah bag official.,2025-05-12 18:21:42.015371
2287,8477,1864,5,North small reflect see nor me.,2025-03-01 09:20:04.329885
2288,16085,227,2,Mind score wear ever your father staff.,2025-04-12 01:16:54.168312
2289,236,4020,1,Trade ability generation if majority wall.,2025-01-31 05:08:47.417201
2290,2051,1507,5,Rest call decide western player their bank.,2025-05-10 16:00:26.101705
2291,17203,633,4,Election still than.,2025-01-31 04:16:19.224324
2292,13831,4239,4,Why view now magazine.,2025-02-15 11:19:13.113567
2293,14812,4219,2,Along want arm field toward option.,2025-01-12 11:49:27.379213
2294,9453,2,5,World career lay fear.,2025-05-08 20:37:38.979590
2295,2514,4625,3,Place yes new home.,2025-01-24 09:34:12.257540
2296,4532,4979,2,Term service contain someone while or.,2025-04-19 02:29:52.485572
2297,11125,3230,3,Anyone walk response crime explain.,2025-01-12 16:58:57.818247
2298,1099,3562,5,Feel and anyone sea then.,2025-03-04 15:40:04.744248
2299,8870,2963,4,Several station process.,2025-04-28 01:19:36.629861
2300,14251,3659,3,Admit from news partner surface follow animal.,2025-01-30 01:32:03.799915
2301,4515,798,2,Style upon half move grow.,2025-02-24 01:40:41.479824
2302,14510,3359,2,Western college stock parent across campaign.,2025-01-22 03:18:14.196517
2303,15844,4475,1,Glass check scientist receive personal.,2025-03-01 03:56:43.207264
2304,11912,2812,2,Nor join north.,2025-05-15 17:18:29.005840
2305,825,2250,3,Behavior suddenly already security his according question measure.,2025-02-19 15:22:59.731153
2306,13406,4469,3,Street now student.,2025-03-24 16:44:41.246238
2307,16327,414,4,Loss recent phone sea book section chance sound.,2025-03-09 04:34:11.095180
2308,15205,2479,3,Industry two still.,2025-02-01 11:45:42.580363
2309,11085,11,1,Its ever edge whatever close.,2025-02-16 19:00:04.943473
2310,19803,2765,4,Join consider give within machine.,2025-03-02 23:11:32.447756
2311,4729,3146,2,How us another respond international.,2025-02-14 20:44:43.345994
2312,9726,4425,3,Open general program discover generation language power.,2025-01-28 20:36:12.148448
2313,9938,4075,5,Since effort goal part brother teacher talk.,2025-03-09 09:06:50.103542
2314,15329,1694,1,Us population see according you own.,2025-02-26 04:59:49.594402
2315,10329,1130,2,Practice agent term own sense art.,2025-03-06 06:39:10.036021
2316,6165,3639,4,Support memory rest despite treat new.,2025-01-10 08:42:27.393259
2317,12978,4971,2,Technology central item.,2025-02-20 02:45:32.668921
2318,19639,3755,1,Turn hope cup argue door policy tend determine.,2025-02-12 11:56:56.554755
2319,4325,423,5,Home whose officer charge.,2025-03-12 09:00:23.183393
2320,18554,1107,3,Determine protect direction general discussion with.,2025-04-30 05:15:48.329463
2321,12800,4027,5,Late save protect case surface cold seem capital.,2025-03-01 04:42:42.056073
2322,18308,3481,2,Yeah into company.,2025-04-15 22:00:44.242742
2323,9915,4382,5,Leg lawyer industry culture reveal social wrong.,2025-01-19 03:20:03.149461
2324,1093,2765,4,Toward space they five body seem.,2025-03-26 09:44:50.618916
2325,13217,3961,1,Between event draw ahead number they term.,2025-05-11 20:26:46.405856
2326,12363,608,4,Face environment treatment.,2025-03-07 02:11:39.392719
2327,9005,4771,1,Dog military decision any forget.,2025-01-18 06:12:58.248715
2328,14529,902,5,Consider form president local.,2025-03-01 17:06:43.503623
2329,1045,3186,3,Social north follow economic.,2025-04-14 21:07:32.598516
2330,18134,329,5,Before opportunity choice southern.,2025-02-14 17:19:26.054863
2331,19627,4507,1,Also outside economic both fill southern group.,2025-03-21 10:53:17.874005
2332,18267,1787,5,Great here growth glass eye allow stay.,2025-04-04 03:03:16.532201
2333,11373,4307,1,Service away member beat mouth author throw.,2025-04-28 13:52:34.207224
2334,16935,1308,3,Help brother certain whole sing art set.,2025-01-27 12:58:48.137609
2335,3966,3883,3,Network likely why four.,2025-04-03 09:15:53.537432
2336,17136,1054,5,Imagine approach low gas compare push.,2025-04-04 23:41:14.063619
2337,15911,3554,2,Only meet suggest nearly.,2025-03-01 01:55:23.499639
2338,15553,3916,1,Morning son dark finish hour others away.,2025-02-22 22:28:32.555863
2339,11065,600,5,Find place or.,2025-03-15 18:29:50.183544
2340,5737,672,3,Today today assume off defense after.,2025-03-27 23:43:30.207072
2341,1392,4863,2,Long case result family computer.,2025-05-09 12:30:17.561788
2342,6552,2041,3,Than choice prove second through.,2025-02-03 09:35:31.600266
2343,12348,2841,1,We wear service seven my.,2025-04-18 04:15:10.944229
2344,10390,1325,5,Use seven let vote produce modern.,2025-04-11 15:11:52.153309
2345,14284,1095,2,Put beyond able administration total pay.,2025-02-15 08:53:38.902602
2346,19325,2045,1,Source agreement nearly music develop force himself.,2025-02-11 17:22:19.653690
2347,14462,1407,3,Personal beyond writer.,2025-04-18 09:30:37.442159
2348,4505,4682,4,Compare despite general over.,2025-03-12 09:52:16.666062
2349,879,3609,3,Economic particularly concern career institution never.,2025-03-10 01:08:41.365392
2350,8307,345,3,Tonight employee possible worker size job hold you.,2025-01-24 02:50:46.957187
2351,19073,1107,4,Cup seven tend exactly cup keep.,2025-04-08 04:21:01.619077
2352,5804,3757,3,Outside field serious quickly account world describe new.,2025-01-30 13:11:53.513918
2353,19176,2610,4,Summer officer yet large.,2025-02-22 10:25:13.985312
2354,2853,4823,4,Left positive along customer land our.,2025-04-05 13:20:14.390168
2355,8413,3149,2,Choice notice five rest.,2025-01-08 10:23:51.704642
2356,11753,1810,3,Evidence young health far easy role man.,2025-03-27 23:12:01.556095
2357,13394,3488,5,Parent particularly mother none never tend.,2025-03-17 09:15:42.287898
2358,13891,1653,2,Us PM administration paper.,2025-03-10 19:00:39.366171
2359,1051,1591,3,Set serve pattern a office also.,2025-03-12 15:06:26.324630
2360,17033,687,2,Turn daughter unit easy detail.,2025-05-04 19:42:12.616117
2361,16431,3284,5,Poor now others available next southern.,2025-01-24 05:30:28.956066
2362,14099,4490,3,Development understand government happen white land.,2025-03-11 19:17:06.145591
2363,18273,218,5,May need thousand.,2025-05-13 01:54:32.558587
2364,9548,3134,3,Near recognize whatever name.,2025-03-12 05:09:09.734692
2365,13515,3078,5,There six range instead.,2025-05-08 13:01:53.176227
2366,10820,2513,4,Energy land travel car work spring each.,2025-05-14 06:57:02.570281
2367,11511,1539,4,Former agent growth develop free there travel.,2025-04-08 14:10:41.301686
2368,813,1893,2,Unit official study assume bad nearly night.,2025-03-07 22:40:14.200712
2369,13153,810,5,Design give range election voice.,2025-03-16 13:15:14.643734
2370,13352,1678,1,Politics hot area assume.,2025-04-20 18:49:59.964100
2371,10162,3530,1,Well today American another style fear.,2025-02-20 19:05:06.767378
2372,9071,238,1,Animal send body research him.,2025-03-14 22:46:51.309857
2373,8625,4797,3,Explain tonight teach explain carry maybe chance.,2025-03-03 07:10:34.781753
2374,434,444,4,Color conference specific receive.,2025-03-05 18:32:25.727572
2375,9006,1743,4,Write but available together.,2025-03-24 10:55:44.565966
2376,15690,49,5,Woman for you move compare.,2025-03-08 20:25:25.336856
2377,15939,568,2,Nature somebody ability page.,2025-01-21 23:09:40.706345
2378,9113,4616,2,Moment reveal forget under.,2025-01-19 14:24:16.877626
2379,13547,3032,5,Wear scene leave by fear general next.,2025-03-05 02:07:10.254729
2380,652,970,3,List last he professor next.,2025-02-03 12:10:07.904393
2381,5339,3325,5,Color thing type Congress.,2025-03-03 07:29:00.043790
2382,10495,2067,3,Degree range talk receive.,2025-03-02 20:07:59.405694
2383,14063,3712,5,Quite home hair up.,2025-03-28 11:36:29.597794
2384,4247,521,4,Pay discussion son clearly.,2025-02-03 15:02:00.423982
2385,4643,1405,4,Dream difficult future score morning staff mission drop.,2025-02-26 20:32:36.057251
2386,11520,829,2,Everyone east own past central remember.,2025-02-22 14:47:52.624135
2387,5644,655,5,Answer water daughter opportunity.,2025-04-09 20:04:59.404419
2388,17809,4024,3,Remember hard catch cold most by must.,2025-02-01 11:53:18.428319
2389,19860,760,3,Price citizen down community south himself fire people.,2025-02-02 09:22:48.031579
2390,8174,4965,1,Choose however perhaps often.,2025-01-17 12:17:53.271562
2391,6583,3780,5,Meeting still coach ok attorney choose big.,2025-02-25 17:22:27.479329
2392,7028,2577,4,Against yeah economy enter.,2025-04-23 23:50:32.144977
2393,8670,2632,5,Statement natural within very minute couple.,2025-02-27 20:53:03.401104
2394,3612,4289,2,Lead beautiful task field until place effort family.,2025-05-05 23:08:57.776401
2395,11241,3330,2,Safe TV find wife college week.,2025-02-03 12:06:28.755715
2396,2518,3044,3,Accept seem lose change education accept she to.,2025-03-19 14:19:46.831827
2397,7028,1593,4,The throw alone.,2025-01-18 19:13:36.837709
2398,19868,3343,5,Level computer camera site.,2025-04-20 05:09:36.319082
2399,14506,795,3,Day who that common stay low carry.,2025-01-05 22:13:51.516321
2400,15143,2498,1,Few material activity budget clear.,2025-03-08 06:21:01.313181
2401,1659,108,5,Development guess health word check current.,2025-03-19 15:35:40.883456
2402,18997,2137,5,Matter develop medical west story.,2025-05-02 08:48:03.444937
2403,450,2476,3,Sign add phone serious.,2025-01-29 12:08:05.862041
2404,9724,3252,2,Sister quickly enter form quality region painting subject.,2025-02-15 16:57:43.596751
2405,3859,4966,5,Through arm message it stand economic majority.,2025-02-28 02:23:03.603790
2406,12075,2824,4,Rich accept thousand.,2025-03-19 18:57:57.467011
2407,4634,1920,4,Support next until marriage statement forget approach.,2025-04-24 13:13:56.746627
2408,8859,946,5,Ok weight notice.,2025-04-25 18:08:15.015682
2409,15679,108,5,Couple senior list recent serious anything.,2025-04-16 07:22:54.560783
2410,18262,4401,4,Politics ever trip never religious glass thank lead.,2025-04-05 23:59:42.938115
2411,1670,1375,2,Artist from finish realize surface.,2025-05-14 21:17:18.011687
2412,11218,241,4,Activity form cup customer their book.,2025-02-26 22:41:22.060899
2413,5009,2348,3,Behavior teacher take buy available response million treatment.,2025-01-28 17:41:17.553425
2414,11322,2299,3,Respond chair economic.,2025-05-03 20:17:34.158711
2415,14773,4637,5,Particularly peace director guess.,2025-01-25 15:52:41.474901
2416,2391,1685,3,Second page week author.,2025-04-08 20:26:26.368887
2417,13323,140,3,Stay up matter want firm near try.,2025-02-14 23:44:07.509025
2418,10653,3162,2,Customer woman house market street author.,2025-02-23 05:27:18.911664
2419,169,3597,3,Before financial camera true order start woman perform.,2025-04-10 06:27:46.339281
2420,4152,2419,2,Challenge you certain religious.,2025-03-30 16:33:53.324898
2421,238,4837,1,Hard capital wonder set.,2025-02-03 04:13:55.028214
2422,6540,471,5,Thus technology else believe choice cultural my.,2025-02-14 00:43:55.705510
2423,18289,766,3,Finish today kind sea own.,2025-02-04 22:17:31.969833
2424,14684,1142,2,Group vote bar.,2025-03-14 16:40:40.609220
2425,12705,1167,5,Professional ground that threat personal.,2025-04-01 05:57:40.622208
2426,4526,2969,2,Tax nation follow trip water.,2025-01-09 12:54:00.630598
2427,4422,1100,2,Culture live the top commercial board.,2025-01-01 07:24:16.460742
2428,2750,4735,1,Standard control drop challenge hold experience place.,2025-01-27 18:52:18.037922
2429,19354,2136,5,Lay full foot.,2025-03-09 23:17:38.763432
2430,2272,1299,1,Ball thank military across we moment write.,2025-04-08 08:40:33.649014
2431,6847,3240,5,Parent security drop past star.,2025-01-05 14:27:18.825280
2432,4702,52,5,Culture position feeling lot little yourself girl.,2025-04-08 03:50:45.480800
2433,18576,2718,4,Way health reach money seat real.,2025-01-31 09:22:06.774385
2434,18429,1824,2,Report human performance computer imagine.,2025-03-21 08:30:18.311264
2435,4135,2845,5,However foot offer ability them likely.,2025-03-27 12:06:44.093771
2436,8233,2504,5,Time news forward nothing good same south.,2025-05-06 23:01:37.576887
2437,8472,1630,2,Score teach such give dinner gas generation.,2025-01-26 10:29:19.096109
2438,19716,4677,4,Piece over end.,2025-03-31 14:51:09.977700
2439,3385,4503,4,Far important season ten although degree last.,2025-04-07 10:42:07.961145
2440,14888,4214,1,Staff such season member manage want.,2025-02-12 22:36:39.306934
2441,16038,670,4,Would position gun hand.,2025-04-14 17:13:35.698471
2442,12451,4500,4,Care able environmental law very goal consider.,2025-03-18 15:42:17.115788
2443,13827,168,2,Network police event.,2025-01-22 18:10:37.161699
2444,3583,3376,4,Team course bring size.,2025-04-13 23:53:05.548442
2445,1292,469,4,Name generation office scene force message customer similar.,2025-05-06 08:05:41.458664
2446,9911,629,2,Far short next eight like.,2025-05-12 01:51:45.518591
2447,11321,4439,3,Financial war social window.,2025-04-26 01:32:18.476248
2448,15148,2706,5,Message that administration lose view standard company.,2025-02-08 21:45:04.174190
2449,15670,2811,3,Age enough country relate.,2025-01-21 01:17:17.135049
2450,2749,2855,4,Join maintain process certainly social.,2025-04-22 12:36:44.179137
2451,25,4457,3,These management part between quite drive join recently.,2025-01-16 22:28:17.173231
2452,4621,493,5,Rise hotel truth.,2025-04-24 03:24:23.402905
2453,18016,2534,3,Language high win computer matter without.,2025-01-13 04:59:21.071997
2454,2180,4514,3,Factor safe force teach.,2025-04-09 02:15:38.717855
2455,18346,2567,2,Business news father show network.,2025-04-20 15:18:43.391212
2456,3840,696,1,Center theory father human price.,2025-03-26 00:40:22.212906
2457,18555,3879,5,Six sort always teach.,2025-02-17 19:20:34.288376
2458,15251,835,4,Suggest approach do college among anyone.,2025-01-06 07:36:37.566827
2459,13821,2674,2,Unit far my site exactly.,2025-04-04 08:45:01.272785
2460,19018,349,1,Majority business whole meeting.,2025-03-19 10:27:14.853866
2461,6496,1422,5,Recent head cultural apply he.,2025-04-08 19:11:06.260138
2462,4860,4675,3,Professor mouth card.,2025-02-24 16:54:53.104070
2463,2315,2441,1,Course boy character their enjoy finish always.,2025-04-24 16:30:10.072829
2464,15263,2320,1,Event state item now behind.,2025-03-19 03:19:30.360214
2465,16413,2373,2,Space left away international power region politics.,2025-02-08 07:27:58.486855
2466,8108,1984,4,Maybe reason everything fear player cause series.,2025-02-22 19:55:24.519797
2467,2235,862,2,Would newspaper me door significant.,2025-04-12 23:47:12.215992
2468,17119,3519,5,Subject statement idea tell.,2025-02-18 22:07:14.017444
2469,1617,163,3,Record operation yeah between others door.,2025-04-04 00:59:26.810236
2470,8303,1609,2,Although garden table talk threat north.,2025-04-17 16:58:50.683455
2471,6256,4200,5,Section person main field open behavior special.,2025-05-17 04:05:04.566768
2472,2582,2310,3,Computer language hospital policy science action walk strong.,2025-05-15 16:03:58.521921
2473,17311,1127,3,Letter future yes Mrs.,2025-04-27 12:07:29.897383
2474,7554,3053,5,Human oil go room life.,2025-03-08 05:08:39.674860
2475,3523,3610,5,Join able thought month allow at throw else.,2025-01-21 10:20:26.738460
2476,16625,844,1,World program hear break bank voice.,2025-03-12 03:02:29.275867
2477,17734,2225,4,See generation activity establish floor turn.,2025-02-07 05:38:03.144589
2478,14794,4552,1,Cup the growth meet.,2025-03-16 16:44:19.246952
2479,17149,3545,1,Buy benefit own spring rate already.,2025-02-11 16:03:09.132299
2480,17263,835,3,And receive charge old office science.,2025-03-20 13:04:09.141992
2481,13645,4913,5,Agreement night bill.,2025-01-09 05:47:20.668728
2482,16129,466,5,Action understand tough conference quite as health.,2025-02-01 22:27:42.226413
2483,19544,3201,5,Front style shoulder cultural I door.,2025-03-28 01:26:34.250885
2484,10658,1970,1,And card most international of become.,2025-01-05 22:53:35.090766
2485,17124,1899,3,Culture station new nation.,2025-01-03 08:37:34.096285
2486,2176,2315,2,Stage shake business risk especially.,2025-01-22 08:51:02.108206
2487,9960,4159,2,Item control development.,2025-04-23 07:39:01.746253
2488,7273,3051,1,Answer get management tough standard attack from.,2025-03-04 05:59:38.908200
2489,10590,1293,2,Send certain size remember.,2025-02-01 03:58:11.248474
2490,6887,4478,4,Program risk remember pull short.,2025-01-20 07:59:36.637423
2491,9430,4051,4,New Mrs serve free across if small.,2025-01-27 23:52:12.836592
2492,13902,4327,3,Professional could church them difference.,2025-02-04 13:16:18.851625
2493,6369,543,3,Not several fine choice Democrat role suddenly.,2025-02-16 15:39:54.593212
2494,18495,2987,2,Available hard not tell least.,2025-03-02 03:49:27.673169
2495,17278,2891,1,Not herself real free.,2025-01-18 04:09:59.045969
2496,2565,3315,2,Clearly huge represent society result against food.,2025-02-06 19:43:23.838278
2497,19623,1240,4,Wife common exactly.,2025-04-20 20:32:12.142085
2498,962,4878,1,Real machine investment turn dream project business yet.,2025-04-01 05:56:36.101596
2499,14363,2963,1,History rise physical ball.,2025-03-29 11:24:48.796959
2500,11972,1579,3,Put join during defense up relationship.,2025-01-05 03:20:54.629975
2501,6129,3796,3,Beat to fund sense turn grow act.,2025-04-04 12:55:12.608318
2502,9217,4260,5,Include if of half travel heart.,2025-04-24 15:21:36.004932
2503,3436,3832,3,Attack apply not discuss act writer someone.,2025-02-14 22:45:32.965670
2504,6988,4950,5,Meet lot team none they what magazine.,2025-02-10 07:01:56.038643
2505,12719,1727,1,Night view break himself.,2025-01-20 06:46:53.487001
2506,8324,635,4,Away daughter why into notice space they.,2025-01-22 18:27:44.472760
2507,16643,2602,4,Way assume have billion six where.,2025-05-09 14:11:22.759556
2508,3851,4487,3,Manager degree teacher customer.,2025-04-05 17:56:36.234258
2509,854,2879,2,Reveal somebody protect save marriage.,2025-02-08 13:55:51.176899
2510,336,1892,1,Without long city nation value art these.,2025-03-05 22:52:28.666896
2511,12279,893,4,Method service article.,2025-02-28 18:07:53.807317
2512,3391,2273,2,Yourself husband through hear.,2025-01-07 02:01:54.210927
2513,14306,4246,1,Behind contain anyone sign.,2025-05-03 09:40:52.817287
2514,71,3503,3,So see have.,2025-04-08 20:21:49.337778
2515,8319,3657,3,Wide discuss buy ask real sense sense.,2025-02-22 00:50:31.921039
2516,17707,2582,5,Group none Congress price special.,2025-05-08 15:05:06.168408
2517,18025,290,3,New like if represent ready little.,2025-01-17 10:49:39.481567
2518,12684,623,5,Save threat challenge Congress there watch.,2025-05-15 08:54:40.129108
2519,13334,1823,5,War throughout see serious hair listen.,2025-05-09 13:25:25.816718
2520,9351,4126,4,Front for notice try physical.,2025-04-17 10:13:28.296698
2521,19665,901,2,Reality four thank else.,2025-02-10 00:06:24.400984
2522,8254,1047,5,Get these organization manage us together arrive baby.,2025-02-28 23:48:11.322663
2523,7065,4959,1,Name fact break room.,2025-02-22 12:13:27.053519
2524,18425,2403,4,Mention prepare stock last their our wonder.,2025-02-13 22:09:31.739382
2525,8972,2920,5,Hear hand focus.,2025-04-20 15:02:24.549620
2526,6573,3775,1,Mother everybody at involve training.,2025-03-13 14:22:54.937716
2527,14472,1377,4,Anything culture campaign black structure bit.,2025-01-04 15:00:52.002260
2528,15584,2259,4,Operation network state financial.,2025-01-21 17:53:48.817652
2529,7742,1442,3,Cut prove democratic same lead decade image own.,2025-04-08 03:44:36.720686
2530,18238,3395,3,Talk use else move father.,2025-04-25 23:24:55.713113
2531,5607,4949,1,Already official rather thank be amount.,2025-02-16 08:48:40.491477
2532,9153,4539,2,Task federal eight prepare.,2025-03-24 09:49:55.955420
2533,1835,819,4,Condition run movement parent technology instead occur.,2025-05-05 16:10:29.357824
2534,1327,4589,2,Along responsibility lead cultural.,2025-05-16 20:14:49.914750
2535,7230,386,4,Great you senior police table.,2025-01-31 21:55:16.605588
2536,18532,1728,2,High detail myself peace cause pick race.,2025-03-05 09:52:21.316444
2537,2667,3770,5,Six list whether time for have leader.,2025-03-18 20:46:51.851271
2538,8351,2983,2,Coach share it attack.,2025-03-12 16:06:37.500306
2539,17441,3101,4,Check heavy parent mention guess increase big.,2025-03-09 04:54:47.261128
2540,12352,3762,3,Kitchen wall interest teacher.,2025-03-01 19:21:10.103542
2541,4108,4339,5,Because happy forget letter son finish animal.,2025-04-29 23:59:48.252554
2542,13400,4823,5,Impact house than pay itself indeed.,2025-04-10 04:05:58.455373
2543,12086,1627,3,Green camera house represent evening enjoy official bank.,2025-02-20 23:13:17.815154
2544,873,2786,4,Hotel behind mention option foreign.,2025-03-21 01:55:33.456842
2545,10999,578,2,Buy school continue right fire with.,2025-01-04 12:37:42.895104
2546,3163,4869,3,See special state treat student until foreign trouble.,2025-05-15 00:32:49.094307
2547,5394,1613,4,Brother appear leg treatment.,2025-03-07 21:55:56.619245
2548,13453,4466,1,Final everyone decide service.,2025-03-30 08:43:42.333527
2549,65,2330,2,Husband career site generation staff some.,2025-03-22 16:38:33.591070
2550,5364,2849,3,Only image about anyone.,2025-01-08 19:45:09.679900
2551,8876,515,3,Agent government nearly as would together.,2025-04-07 06:50:51.781654
2552,11991,968,4,Environment game bed amount shoulder degree.,2025-05-09 22:43:37.037362
2553,15668,3970,3,Table free where television.,2025-03-24 21:33:03.829496
2554,12519,2059,5,Require give reveal today seem Mr.,2025-04-12 16:01:47.755266
2555,2895,3108,5,Sign choose really woman.,2025-01-12 16:40:10.820763
2556,1547,3494,4,Vote score near member themselves almost scene.,2025-05-01 04:21:15.982109
2557,19459,597,2,Student which game safe throw score.,2025-01-02 16:13:51.793184
2558,15319,4275,4,South hot this another not open.,2025-01-01 13:01:18.252384
2559,11790,2379,1,Reach painting field knowledge machine.,2025-03-26 09:11:25.365307
2560,15641,1491,4,Society energy end finish break.,2025-01-01 02:30:05.257961
2561,7689,3965,4,Half type old suffer as party.,2025-01-02 14:29:34.988614
2562,15390,3875,1,Tend audience line responsibility.,2025-03-14 13:46:29.014275
2563,15711,3414,1,Behind dog catch character several citizen manager.,2025-02-04 00:47:45.428845
2564,1248,2299,5,Indicate value serve child tree.,2025-04-30 01:13:54.296813
2565,5273,2693,2,Doctor word subject benefit life part.,2025-05-03 13:57:21.854526
2566,4127,4952,5,Young through let serve describe.,2025-04-06 12:21:34.464558
