review_id,product_id,customer_id,rating,review_text,review_date
1,11955,4180,4,Watch career treat.,2025-01-15 13:59:06.645285
2,6918,4193,2,Suddenly month carry hotel week.,2025-02-24 02:34:36.657353
3,14175,2889,5,Station either hit material into.,2025-04-25 13:00:02.754816
4,12709,4868,4,Evidence specific give none around if.,2025-03-08 21:11:29.844769
5,669,2323,3,Evening whether common boy over evidence cell business.,2025-01-07 05:17:21.816123
6,5202,2853,4,Across soldier investment item.,2025-05-08 11:38:27.490602
7,14572,4436,3,Forward try government hand through piece beautiful.,2025-01-31 01:56:01.663915
8,11786,957,1,Year think trade listen traditional.,2025-04-27 20:32:54.329237
9,4507,448,5,Somebody act others society board grow.,2025-03-01 13:53:35.941682
10,16791,4365,1,Job ok around first.,2025-03-07 05:06:00.837336
11,13022,1300,5,Good include four foot.,2025-01-30 02:07:57.256453
12,14676,3832,4,Record vote lead.,2025-04-04 11:50:47.810952
13,18546,290,4,Try bit adult.,2025-02-05 05:47:12.531447
14,7931,999,4,Happy than look my executive population range.,2025-03-26 10:45:28.699734
15,11742,4046,5,According more whose training.,2025-02-16 22:19:11.257050
16,11557,3101,5,Condition fill bit politics design benefit.,2025-01-12 18:32:16.572107
17,1240,4737,5,Lot relationship information necessary.,2025-03-31 04:07:45.777270
18,12239,1384,5,Big listen boy culture.,2025-04-29 15:02:58.702412
19,10182,4226,2,Toward news white young.,2025-03-21 23:43:28.433082
20,13961,3768,5,Allow sister economy become young kitchen stay.,2025-03-21 01:34:30.889737
21,10891,3623,1,Energy weight thank when red maybe cut.,2025-02-06 04:42:51.254737
22,17488,4128,4,Star treat woman require for meet prove.,2025-02-02 11:53:45.934184
23,5794,4008,3,Watch stop probably attorney worry.,2025-01-27 05:46:15.991775
24,5184,132,2,Red rest agreement including decide win gas.,2025-01-20 05:58:48.155068
25,16600,1284,2,Ready education anyone sometimes.,2025-03-06 20:08:10.516768
26,11201,3210,4,Ten idea score father suffer.,2025-02-04 16:16:16.222382
27,19883,605,1,International song father remain really.,2025-01-04 01:16:12.221567
28,11664,1211,2,Situation major relate black young.,2025-02-07 18:34:18.107632
29,14122,66,4,Thought per crime realize entire analysis outside.,2025-02-10 10:33:56.314297
30,17536,1267,2,Mention stop admit environmental.,2025-01-01 19:35:26.147143
31,12902,4621,5,Fact agree nation government employee only.,2025-03-05 23:09:59.462010
32,13183,3096,5,Mind real white story politics trip never lot.,2025-02-20 10:54:31.025796
33,16688,4249,1,Thought exactly ten owner democratic author upon.,2025-04-16 12:23:07.265006
34,13354,4097,4,Case nice condition agree she present seek.,2025-01-05 17:38:49.578828
35,19370,943,5,New work south half form enough good.,2025-04-05 01:35:15.904912
36,7914,645,1,Person move discover past wind build.,2025-04-17 22:40:20.678743
37,13026,2891,4,Democrat economic skin generation economic bank such.,2025-01-30 04:25:32.575172
38,17952,4538,1,Friend draw skill fine machine none.,2025-04-08 13:45:53.174175
39,9977,4416,4,However difficult onto stand travel up allow.,2025-01-21 04:52:49.695596
40,10772,3637,1,Performance speak world.,2025-05-06 18:26:03.864318
41,16707,2817,5,Sport teacher allow feel service determine.,2025-02-14 08:02:06.089666
42,19566,2361,1,Sign minute office.,2025-01-16 14:43:41.465340
43,8022,3235,1,Somebody both try inside.,2025-01-06 07:16:21.622832
44,15611,2438,3,Conference our little create here goal for.,2025-04-02 03:29:27.050069
45,6779,4170,5,Choice strategy sometimes also interview well star.,2025-02-02 00:33:19.840714
46,6313,2477,3,Their high organization final pattern.,2025-03-23 18:46:08.992163
47,1560,93,2,Sound large structure resource develop Congress.,2025-01-16 16:51:03.968663
48,10170,3225,2,Yard can stage energy professor property friend.,2025-03-24 22:20:27.037421
49,18034,765,1,Debate gun way tough though maybe compare.,2025-05-12 17:11:29.400842
50,6448,468,4,According exist soldier city rather.,2025-01-10 22:42:29.639199
51,12385,3596,1,Product time high walk own brother article.,2025-03-18 23:22:19.857562
52,17427,3909,1,Senior history age special product line rise.,2025-04-27 22:14:42.332675
53,9954,3937,3,Break enter audience grow candidate almost.,2025-01-29 15:55:24.211182
54,18940,1920,2,Scene give smile suddenly generation ten current their.,2025-02-24 13:52:21.473011
55,13710,2196,1,None few picture check final all civil real.,2025-03-04 16:12:34.269396
56,9643,246,5,Step include ask trouble stock director dinner figure.,2025-01-18 09:31:45.295806
57,17403,4194,5,Word per much while much.,2025-03-26 19:02:11.154713
58,724,2806,3,Hand teacher tell might sound ball.,2025-04-28 18:41:49.440753
59,7496,1028,4,Support follow case painting occur election boy best.,2025-03-08 21:17:33.685930
60,1033,796,5,General open apply visit business.,2025-03-25 08:10:31.998704
61,1919,4772,5,Happen your professor try.,2025-01-09 04:05:39.124735
62,14080,4022,5,Nor instead conference.,2025-03-18 02:10:19.881249
63,15397,3685,2,Dinner choose between career light.,2025-01-10 03:06:13.787204
64,18148,2594,5,Hard sometimes test road room grow although.,2025-03-03 14:12:49.194750
65,6096,110,3,Treat threat represent support.,2025-03-08 12:18:03.024270
66,5457,3699,4,Walk still budget myself agree woman idea.,2025-03-14 17:19:29.307226
67,3126,3047,2,Major only like.,2025-01-13 09:51:33.756203
68,1152,3431,2,Fire cover growth.,2025-03-23 06:28:54.722509
69,14053,3410,1,Office upon later.,2025-03-31 19:00:19.235240
70,8072,262,4,Evening color on yet carry financial must.,2025-04-08 00:41:13.271188
71,17676,4993,4,Simple television contain full direction look.,2025-02-07 02:55:41.980335
72,17521,4705,4,Glass quickly professor writer return.,2025-05-10 10:23:54.035986
73,6534,3200,3,Responsibility song avoid than do.,2025-01-28 07:14:39.829640
74,12527,864,3,Phone case college whole.,2025-04-07 04:03:27.246651
75,16127,4790,1,Hospital daughter surface oil college laugh be.,2025-03-31 03:42:49.764375
76,3453,2242,3,Line strong number thus.,2025-04-24 21:17:26.968201
77,4984,3548,1,Ago affect experience tree green quality.,2025-02-23 03:30:24.731960
78,16927,2581,5,Prepare seek meeting size here.,2025-01-30 05:24:26.569422
79,5856,2118,4,Reveal call everything.,2025-02-01 18:53:37.229533
80,9900,803,5,Hard involve down good.,2025-03-18 20:55:29.082698
81,9001,4252,3,Card effort whether language number visit.,2025-01-24 03:26:23.651323
82,17105,4017,4,Open probably federal avoid international even level.,2025-02-14 12:44:34.804985
83,12218,3602,5,Drop name personal citizen health.,2025-05-03 01:21:24.899626
84,17817,319,4,Firm else story resource family direction.,2025-04-23 06:30:19.403070
85,19355,3408,3,Buy it quality rule foreign.,2025-02-10 16:48:39.618972
86,306,2858,5,She question financial trial grow lawyer fire total.,2025-02-26 06:15:25.014146
87,17274,4611,5,Dinner especially score present interview station authority.,2025-05-03 05:35:22.159454
88,19880,1371,4,Herself others sound simple cell.,2025-04-17 14:50:32.977779
89,14276,4453,4,Study bank camera member.,2025-02-02 11:03:23.787972
90,8252,2492,5,Choose toward century produce age information.,2025-03-05 23:16:20.264423
91,10607,4239,5,A teach under before.,2025-02-04 02:31:40.553960
92,16372,2135,4,Matter realize dark wide.,2025-05-15 14:16:08.761424
93,14539,3434,5,Control guess matter why show level.,2025-01-29 20:40:28.244167
94,8603,4029,5,Gas girl cup second economy.,2025-01-24 08:50:43.675010
95,8165,519,4,Consumer rest have simple option science.,2025-04-05 11:17:07.013183
96,752,2965,4,South history later recent point summer.,2025-05-14 07:38:08.598133
97,9420,424,4,Employee democratic man.,2025-04-18 13:04:40.229775
98,2815,3412,3,Father worker recognize do.,2025-01-27 03:12:24.693514
99,14065,4623,1,Take party same arrive.,2025-04-11 22:46:11.115142
100,10464,4010,5,Box friend conference hit.,2025-04-20 10:29:13.994781
101,11994,4957,1,Ago tough attack professional tell.,2025-03-12 23:10:01.660389
102,8968,1447,1,Ready animal nearly follow own deal.,2025-01-03 10:13:34.595498
103,2177,1285,4,Often join others standard PM short.,2025-03-31 14:09:24.183753
104,15581,3609,2,While year bad understand become he.,2025-03-01 22:21:08.971530
105,2230,2466,5,Magazine leg radio may several beyond assume admit.,2025-04-08 09:26:56.476189
106,9140,3237,4,Speak who on against party tend amount weight.,2025-03-08 15:56:54.850391
107,13064,2428,2,Community fire decide lot history important.,2025-04-28 23:19:36.524544
108,1879,4773,5,Rule with standard back lead government week.,2025-05-05 20:38:03.199419
109,9384,3800,4,Campaign understand make table upon shoulder no.,2025-04-12 08:35:15.344453
110,6926,3605,2,North time guy author see far memory kitchen.,2025-02-05 15:41:18.924012
111,3974,999,1,Opportunity medical feel common have stop occur.,2025-04-18 14:40:10.403594
112,14897,4264,5,Event fire upon let table physical.,2025-03-09 16:29:54.560454
113,5613,43,4,Marriage according during.,2025-04-11 23:17:27.409110
114,3617,1370,4,Throw student pressure home somebody.,2025-03-13 17:40:36.799368
115,10593,4626,4,Himself sea effect easy might six.,2025-01-30 21:40:21.748978
116,12445,2909,3,Close director against fish.,2025-01-27 08:24:16.928806
117,3042,4115,3,Send senior wife spring understand if game particularly.,2025-01-06 23:10:34.296625
118,12215,4404,4,Stock toward leg civil.,2025-01-20 20:32:16.724802
119,17623,3885,5,Full over manager.,2025-03-22 15:14:34.919700
120,10434,3446,2,Natural free manage.,2025-02-28 18:32:50.212647
121,18367,4547,5,Job effect network simple race just already.,2025-05-10 15:38:59.770117
122,3519,704,1,Indicate free subject real near.,2025-04-29 20:01:00.873425
123,12455,3066,5,Training yes building later behavior final position.,2025-02-07 23:21:14.122153
124,12134,1959,5,Present issue understand face hospital improve purpose.,2025-05-01 19:38:12.437386
125,10964,3818,5,Bed writer shake avoid piece lead in water.,2025-01-14 08:09:16.434538
126,19572,3395,5,Money tonight issue better week.,2025-04-08 02:08:21.623850
127,17550,2366,3,Man different speech fight compare carry.,2025-02-22 21:10:37.165227
128,6193,2325,5,Music production general discussion fill article.,2025-05-02 08:38:02.630764
129,7399,4343,2,Develop help beyond hair sport lay they.,2025-05-09 11:42:30.566216
130,11850,1338,2,Administration we example four person name far suggest.,2025-03-08 00:51:25.445963
131,2915,1963,3,Size surface fact give author front.,2025-05-15 10:01:51.393151
132,12756,1221,2,Born forget real bag she.,2025-02-10 23:22:13.756521
133,13200,4847,3,Fill arrive pretty against face.,2025-04-23 14:02:27.408114
134,6299,3675,2,These knowledge live race level my player.,2025-04-07 09:20:23.074378
135,17711,4507,1,Magazine note skin direction design new southern.,2025-01-29 01:42:11.372161
136,10654,2691,4,Ever half develop billion.,2025-04-07 13:51:12.766906
137,3851,3380,4,Idea piece decide air.,2025-02-10 23:02:37.263940
138,14643,4232,3,Now major data east.,2025-03-23 02:50:28.843587
139,9153,4293,2,Remember west charge summer.,2025-04-10 09:31:26.203448
140,16769,3895,2,Indeed medical card cover point.,2025-01-01 08:47:16.473037
141,13359,2487,2,Four myself watch sing school social watch.,2025-01-06 02:57:17.753161
142,19605,1862,5,Mission environmental win past spend fear.,2025-02-19 18:38:59.564054
143,18871,3683,1,Community Democrat serve crime yeah might.,2025-04-07 17:03:04.037148
144,2462,3618,2,Face color now project call.,2025-04-27 15:52:54.743848
145,1691,2700,5,Never nature hospital news floor.,2025-03-16 15:01:07.073947
146,13354,1286,1,Use product surface clear.,2025-02-28 04:07:00.246766
147,1765,3649,2,Sing wide argue girl create.,2025-04-16 00:21:59.825268
148,18594,3496,5,Executive less him together management debate sort.,2025-05-16 05:02:05.813962
149,18722,3161,3,Course north as measure exist cell.,2025-01-15 12:27:19.326287
150,4338,2322,3,Treat do drive floor worker region site.,2025-02-16 07:04:30.089256
151,1950,1757,1,Leader scientist bit.,2025-03-13 11:25:39.134459
152,7306,2935,1,People address production camera political loss western.,2025-04-08 10:30:01.936713
153,12390,1714,5,Station scientist describe reflect development with.,2025-05-02 13:30:49.462409
154,12649,1403,2,Accept my down along think consider decade family.,2025-04-16 19:22:16.701673
155,7582,4845,2,Point different radio enjoy strong must.,2025-05-07 03:45:45.449856
156,11532,4836,4,Decide summer own day today page evening.,2025-02-23 16:17:08.790749
157,15025,2219,1,True dream rock every upon.,2025-03-11 16:33:51.078815
158,6537,195,3,Certainly direction operation chance yet.,2025-03-06 19:52:37.695730
159,17775,3771,3,Morning for stand agree blue side.,2025-04-29 01:51:42.002253
160,3204,574,5,Decision turn doctor chance believe.,2025-04-24 19:38:25.730307
161,17819,2079,3,Thing letter activity range charge give certainly.,2025-03-21 18:42:03.917012
162,1279,3416,2,Movement result fall on step try.,2025-05-04 02:28:29.595999
163,5588,1945,1,Save thought work foot professional.,2025-02-18 09:40:08.601740
164,7001,3544,5,Interesting who style arm.,2025-03-20 07:45:32.657735
165,10159,4255,1,Marriage meeting sea politics myself.,2025-01-12 15:06:09.444976
166,4017,3580,4,First service production care leader north range large.,2025-01-29 13:44:59.699304
167,19176,2866,2,Both another station deep design single.,2025-02-02 08:19:04.742602
168,9252,4973,2,Ever already idea night especially age.,2025-03-11 04:41:36.192665
169,9304,4625,1,During accept bad color begin.,2025-02-26 21:51:32.109491
170,14271,1739,3,Natural seven receive rule join mission and.,2025-02-19 19:09:14.682553
171,5605,985,3,Themselves structure somebody quality certain exist.,2025-02-10 11:32:06.039720
172,7158,212,1,Weight teach lot military.,2025-01-27 11:18:14.837184
173,7631,923,3,Body compare force the.,2025-01-27 02:03:53.328807
174,18748,3176,4,Image whatever class research close.,2025-05-11 12:31:37.270570
175,9897,3403,2,Job space art almost.,2025-03-24 12:39:02.602064
176,1577,2250,2,Age position anything food.,2025-03-08 13:48:53.940566
177,7491,4928,4,Social reduce street hospital leave ten people.,2025-01-10 15:02:12.775537
178,9849,1241,5,Out check impact according mother stand air.,2025-01-18 12:23:16.206456
179,19854,4089,2,Line summer whose what thousand.,2025-02-01 06:59:26.709327
180,19876,3007,2,Item coach similar through best training arm.,2025-01-16 07:31:19.812856
181,7239,2863,1,Blood claim thought section staff.,2025-04-14 13:48:43.489859
182,7068,1833,1,Myself computer may right per determine.,2025-01-02 07:40:56.862054
183,6337,2222,4,Collection him perhaps method thus.,2025-01-15 08:53:46.859188
184,2493,4748,5,Beyond provide realize wall indeed sell.,2025-03-24 22:44:07.159590
185,15352,3568,2,Ok hope return organization down cell.,2025-01-26 22:25:29.495982
186,19232,2174,5,Beautiful option impact much power.,2025-03-31 21:54:47.756428
187,16486,4677,2,Personal point statement list old relationship.,2025-01-12 21:05:47.019944
188,936,1087,5,Finally daughter him significant seven.,2025-05-15 14:14:39.503503
189,15599,3374,4,Business yeah glass.,2025-01-22 01:32:56.690379
190,454,500,2,Whose business to research.,2025-03-11 18:59:26.318620
191,16849,1574,3,List yard meet lawyer contain his.,2025-05-08 15:22:46.125206
192,7330,563,2,Week be bank detail yard father.,2025-05-02 13:34:26.378819
193,15320,4856,3,Lose try memory piece girl behavior goal.,2025-03-20 21:08:07.192834
194,605,2538,3,Require relate fine listen herself life positive.,2025-04-07 09:41:50.752687
195,11780,544,2,Deal forward partner seem ball.,2025-04-01 00:52:45.536302
196,14669,2190,5,Stop finally ago ok writer.,2025-01-12 00:59:59.475900
197,12219,3437,3,Conference attorney establish guess these traditional action.,2025-05-15 12:11:39.454035
198,4043,4334,3,Market me agree easy.,2025-01-06 15:26:16.698773
199,19317,1626,1,South what husband dog skill.,2025-02-23 21:21:18.992316
200,8334,1356,2,Treat realize left really prove.,2025-04-21 12:26:08.055493
201,19030,3221,2,For push government.,2025-04-21 21:50:03.648523
202,7203,4715,4,Answer ability Mrs drive building.,2025-01-06 23:31:04.038744
203,12060,4447,2,Involve hear wear teacher enjoy result.,2025-03-08 06:43:19.728338
204,648,4225,2,Beat against politics heavy.,2025-03-15 13:50:36.403494
205,17676,3134,3,Professor party thus left laugh study spend.,2025-02-04 16:58:21.570077
206,3340,2756,1,State one before enter.,2025-03-20 19:30:58.297116
207,16661,3874,3,Somebody international old final face.,2025-05-01 00:54:30.118528
208,8091,2130,5,However everyone agreement old blue send.,2025-01-10 20:25:04.917675
209,937,3130,1,Coach board which guess.,2025-04-16 13:27:15.112178
210,16454,798,4,Cup memory agreement factor chance election project.,2025-03-15 16:10:47.929845
211,17868,2514,5,Hair process you mouth game cost turn.,2025-01-03 20:57:30.394925
212,14577,1819,1,Tend drug leave perhaps effort board part.,2025-02-07 12:24:15.508718
213,11395,3817,5,Front among assume already floor.,2025-01-01 07:43:16.749300
214,14126,1039,1,Size game head region include.,2025-05-10 02:52:22.556484
215,9683,2911,5,Language just reach today.,2025-01-06 01:24:37.292370
216,5205,578,5,Decade fly again responsibility expect learn.,2025-05-06 01:07:29.414992
217,6123,4412,5,Lawyer data black street identify bed.,2025-05-16 05:51:27.738161
218,2526,1680,4,Provide family field shoulder necessary well.,2025-03-08 23:16:00.209682
219,19855,2892,2,Sort character score against.,2025-04-15 18:00:43.153609
220,5796,1778,2,Market form common tonight.,2025-02-21 08:39:21.597984
221,14456,3693,2,Shoulder subject they avoid anything term group.,2025-04-09 09:39:16.629552
222,8645,1386,3,Popular site write religious open arm gun.,2025-01-31 05:51:56.603046
223,3622,1625,1,Personal painting our within whom table leg.,2025-02-01 05:22:05.452471
224,17527,806,4,Would like main another help all.,2025-04-14 07:16:57.043499
225,865,4615,4,Necessary between moment shake.,2025-01-01 07:55:04.425821
226,13598,3330,2,Political though score phone about.,2025-03-22 11:35:32.045477
227,847,1391,2,Finally political seven.,2025-03-27 12:09:10.302295
228,15261,893,5,Do man property art shoulder.,2025-04-13 11:04:59.836643
229,16822,2598,5,Board television art southern.,2025-04-02 16:06:40.482517
230,16194,4745,5,Fly least clear information speak.,2025-04-27 02:18:18.869502
231,3106,2346,3,Short full quickly after according.,2025-01-12 13:27:17.047798
232,17026,217,3,City today movement his protect ok modern.,2025-05-10 05:16:23.502486
233,4929,2058,3,Quality time happen let.,2025-01-23 04:42:57.040319
234,12521,3631,4,Job lose price miss control.,2025-01-31 04:17:22.172231
235,11540,1787,5,Foreign statement maybe fly down drug.,2025-04-13 23:51:02.849264
236,2586,2122,5,Across woman large same spend begin commercial.,2025-03-13 02:49:36.558563
237,17436,4540,5,Necessary he parent writer hundred wide half.,2025-05-07 04:21:11.799955
238,15907,2062,3,Account check again of certain adult effect.,2025-01-19 13:15:24.449398
239,17184,774,2,Example cost actually official record majority.,2025-03-17 17:46:01.206477
240,4086,3639,4,Say sing standard beyond.,2025-04-24 11:35:03.734043
241,4253,1129,3,Foreign professional power market none.,2025-01-17 04:09:07.536454
242,18333,2418,4,Office weight summer until grow environment choice.,2025-01-03 21:34:09.423414
243,8195,3406,1,Again then yeah nice.,2025-01-24 22:41:32.144961
244,19175,4321,3,Prevent stage certain inside sense.,2025-03-18 09:29:38.169260
245,13288,228,1,Practice store character cell.,2025-05-09 00:51:52.591048
246,8943,2792,1,Finish may civil table.,2025-04-23 01:31:37.807820
247,8725,3887,1,Serve hard common oil protect.,2025-03-11 23:53:27.028616
248,5938,1200,4,Well make world item agent.,2025-04-04 15:07:48.601432
249,8224,3755,4,Suffer plan their job walk.,2025-01-02 12:09:14.805551
250,17971,2612,3,Record candidate economic bill current.,2025-03-10 02:42:56.781799
251,13731,42,4,Lose as certainly travel serious myself sign.,2025-01-29 19:27:07.805654
252,5792,4279,5,Financial education newspaper class evening who.,2025-04-16 04:38:28.424726
253,13308,4498,5,Election whom easy question weight try way certainly.,2025-03-26 02:29:07.104327
254,18538,1418,5,Popular husband century can process admit make might.,2025-02-14 19:04:11.789935
255,4643,4249,4,Raise sure network since receive total buy.,2025-03-07 13:30:33.197797
256,10096,2078,1,Protect tax model heart interest your.,2025-04-06 03:21:26.260931
257,8423,331,4,Company sound rock never go.,2025-04-24 04:26:16.937617
258,10591,568,5,Color doctor speak page theory describe century.,2025-04-08 05:49:25.942736
259,17342,3299,1,Yourself citizen professional space physical.,2025-04-30 08:53:28.481236
260,12305,4216,5,Talk base threat try past someone including.,2025-03-10 19:18:29.655149
261,13588,3626,1,Opportunity find land air face responsibility.,2025-03-12 02:04:41.798319
262,1700,3280,5,Race ahead operation peace relate have summer.,2025-05-04 12:03:14.091442
263,9022,3647,2,Only rule machine try most ground rich.,2025-01-31 07:55:17.651500
264,2124,4755,1,Necessary day though tell somebody detail camera speak.,2025-03-05 10:09:58.432113
265,824,3662,3,Medical rich choice ago.,2025-03-18 23:20:02.451463
266,382,1752,5,Imagine ever possible add always kid.,2025-03-15 22:03:54.310239
267,3619,4219,2,Property finally research campaign purpose.,2025-02-20 14:01:02.561942
268,7747,2928,4,Partner wind group down.,2025-02-01 14:14:33.834555
269,19130,1748,1,Stock not out follow believe out.,2025-04-06 03:10:19.200797
270,16386,3727,4,Blood watch avoid bag myself nothing surface.,2025-01-14 04:06:34.491304
271,6195,2919,1,Spend billion serious or alone either their.,2025-01-18 05:34:30.429251
272,15726,3788,2,Security industry about my maintain indeed.,2025-03-11 17:25:24.608714
273,2059,911,2,Show case indicate family red several.,2025-05-16 15:24:08.553435
274,14294,2062,2,There will low law career day learn.,2025-04-26 08:29:15.810136
275,8852,4606,1,Practice magazine beautiful investment.,2025-01-08 00:32:14.041240
276,8047,2136,2,Thus good program glass particularly run.,2025-02-04 06:16:02.094404
277,13828,3753,5,Establish need including rich eight make.,2025-01-31 12:21:03.790558
278,14953,4361,1,But fill newspaper stock leave although people.,2025-01-09 01:02:19.438880
279,6350,1713,4,Mind exactly prove business close above.,2025-03-17 18:21:51.335105
280,16634,2826,3,Card modern account seem it southern.,2025-03-04 10:35:37.070551
281,12593,928,3,Research prepare appear experience.,2025-04-09 06:31:04.897819
282,6184,3907,2,Level wrong economy we share recently study.,2025-03-23 21:07:40.996279
283,2689,4759,4,Identify site this office set.,2025-02-17 08:23:59.551339
284,11992,1563,2,Former produce choice close.,2025-04-29 03:56:54.924246
285,2424,1343,5,West help car tax tough clearly week.,2025-02-28 03:58:30.843385
286,19912,4700,4,Cut theory ago experience.,2025-01-07 18:38:13.611333
287,16200,4585,4,For hit box.,2025-03-06 13:58:40.696430
288,17873,2861,4,Across lay service pattern able practice.,2025-03-30 03:43:22.300665
289,7777,4596,1,Fund shake majority girl outside him pay.,2025-04-09 07:10:53.357776
290,19405,2076,2,When a of I.,2025-05-14 06:42:40.808778
291,5660,2496,3,In teacher last result base notice state.,2025-04-13 15:05:36.760168
292,19542,940,1,Part answer explain say south across.,2025-04-27 14:13:02.821008
293,1550,685,3,Claim activity seat least.,2025-03-15 18:55:10.155901
294,13413,4670,1,Near trouble daughter white.,2025-05-15 17:16:46.844024
295,10558,3603,3,Poor miss range indeed and southern.,2025-02-22 16:50:31.163200
296,930,1470,5,Wife foreign head authority reveal forget.,2025-02-15 04:48:26.413323
297,596,2200,2,Floor different that.,2025-05-05 11:18:31.761658
298,15046,1110,2,Adult in service.,2025-02-03 00:55:21.275857
299,9766,3913,3,Daughter environmental court only range receive hand get.,2025-02-09 05:30:16.900726
300,3471,2111,1,Side source tree response sit training free.,2025-01-29 22:13:39.762545
301,358,1102,4,Fight before trade far production market despite.,2025-04-21 05:24:14.940878
302,15436,1361,5,Blue woman lay tough environmental.,2025-05-10 22:36:03.708562
303,1291,3835,4,Car choice husband southern owner.,2025-05-10 14:14:30.429504
304,9268,1356,2,Same plan nature condition young pull.,2025-05-09 07:18:12.838464
305,9925,2035,5,Both same painting after.,2025-01-18 15:14:58.315356
306,14575,2733,5,Body stage write fact people people have.,2025-02-17 15:39:16.141480
307,13348,2438,5,Material actually save event.,2025-01-03 18:11:07.012792
308,10230,701,2,War at final.,2025-04-28 03:53:23.980790
309,10988,4600,1,Group high realize executive stop nothing of.,2025-01-30 07:02:00.525059
310,363,1511,1,Ball morning consider building make.,2025-04-07 01:15:50.562365
311,12900,84,3,Tv particularly become service me cup.,2025-01-22 11:50:33.851283
312,1459,3364,1,Big modern different simple make very.,2025-04-28 14:42:20.142003
313,16620,4181,1,Himself set deal base for.,2025-01-09 00:14:09.485925
314,1198,2391,3,New film rise seek experience policy.,2025-04-29 08:43:37.239872
315,10183,2494,2,Husband also result analysis particular family stay everybody.,2025-04-26 16:04:23.208557
316,6738,2201,5,Peace responsibility lay fund Congress evening federal.,2025-04-06 01:32:44.978866
317,15927,3668,1,Success really now many member.,2025-01-23 02:12:22.874893
318,10675,630,5,Stay do catch discuss moment girl chance notice.,2025-02-28 20:48:39.675944
319,664,1912,4,Almost campaign certain hard.,2025-03-19 05:57:22.567865
320,9829,2614,2,Professor staff food tell vote relate.,2025-03-28 03:41:51.886663
321,11510,1995,4,Stock positive amount want bar.,2025-04-02 17:03:05.131150
322,7885,2681,3,Citizen feel reflect.,2025-04-07 15:34:20.088867
