review_id,product_id,customer_id,rating,review_text,review_date
1290,15986,1748,5,System task her instead gas plan.,2025-02-03 05:43:50.059096
1291,19290,1611,2,Ready pretty a behind right conference each have.,2025-01-14 03:13:29.313125
1292,2475,2827,1,Cause them high give cause power.,2025-02-26 07:17:51.729658
1293,14586,3982,5,Experience successful job sea computer bed.,2025-02-12 11:30:52.982047
1294,17764,485,2,They then contain close.,2025-02-17 22:47:28.914512
1295,15833,4073,4,Attorney social ability.,2025-02-01 08:03:04.566359
1296,1964,969,3,Office old down main.,2025-02-09 19:33:59.003219
1297,6999,3129,2,Evidence represent issue involve once.,2025-03-16 18:15:37.164709
1298,981,1185,1,Early program positive yard reality run.,2025-05-06 19:17:40.198782
1299,9826,2672,5,Movement put including capital property kind.,2025-05-13 14:06:48.968684
1300,16779,1012,1,Hundred policy strong audience begin interesting crime.,2025-01-16 15:23:47.287400
1301,12220,471,3,Sport save each strong.,2025-05-07 05:29:24.280031
1302,11904,2065,5,Edge red game owner third.,2025-03-04 09:39:32.046463
1303,12052,906,4,Center strong management factor last worry as.,2025-04-15 16:05:26.280109
1304,10495,4683,4,Prepare study PM national most.,2025-04-30 02:43:02.313734
1305,6833,859,3,Name worker table imagine.,2025-05-13 16:06:19.920825
1306,15117,23,4,Building people really.,2025-01-20 10:16:22.121752
1307,3158,4234,4,Place impact play in standard treat.,2025-05-05 02:14:44.188805
1308,6935,1292,3,Dark company friend less evidence.,2025-04-05 10:57:02.870908
1309,6043,825,2,Bill stay condition first air mother.,2025-02-19 02:13:20.269023
1310,19369,1545,5,Before scientist trial relate western collection.,2025-01-21 08:59:27.756639
1311,6576,4415,3,Grow action might money south left.,2025-01-03 05:53:26.644851
1312,11664,2135,2,Financial professional huge parent.,2025-01-03 12:25:35.910118
1313,18535,4054,1,Girl I area president.,2025-02-10 23:41:48.330214
1314,15589,2642,2,Ask actually center dark.,2025-01-10 19:23:18.409854
1315,1799,2094,2,Provide control write option.,2025-03-26 13:54:43.291443
1316,9555,1309,1,Everyone thousand environment staff thing politics.,2025-04-02 17:05:41.466019
1317,12593,2013,2,Bad foot yourself.,2025-04-07 18:23:40.922585
1318,7372,4248,2,Need perform who begin air during throughout.,2025-02-05 10:53:36.939786
1319,10267,4937,4,Pick Mrs speak two of common.,2025-03-04 03:33:32.176640
1320,12971,1723,3,Team it field find.,2025-02-05 11:49:34.860432
1321,15490,1206,1,Democrat run help sister growth sport.,2025-04-14 23:32:41.045187
1322,1751,695,2,Student source bill.,2025-02-24 17:43:54.850485
1323,13752,2307,1,Bar him model through.,2025-02-26 07:10:14.377676
1324,11718,4881,4,Simply guy process behavior reduce successful teach.,2025-03-04 02:31:32.287283
1325,13036,3285,4,Economy provide campaign image trade speak.,2025-04-02 18:14:17.043593
1326,10926,4538,4,Group watch remember early certain back.,2025-01-10 09:07:38.694223
1327,12021,1253,2,Development their learn score natural radio sense.,2025-04-20 17:21:50.986751
1328,17684,2713,2,Address seven hospital soon.,2025-03-27 11:19:10.213214
1329,5195,1230,5,Certainly position east trade movie.,2025-01-07 23:58:01.547605
1330,8049,484,4,Situation prevent Congress seek system billion.,2025-03-11 21:28:46.845841
1331,3799,3076,5,Senior interesting meet view find miss.,2025-02-13 09:46:41.650009
1332,17542,415,3,Stay address key knowledge happy.,2025-01-22 09:48:29.887358
1333,14067,2967,4,Late require against wear that.,2025-01-10 08:15:45.529962
1334,13112,1183,2,Onto eight raise wait hand very control force.,2025-02-27 09:24:13.438734
1335,6729,1964,4,Always bad happy get.,2025-02-22 11:34:34.511571
1336,10972,2719,3,Sense crime Mr seem television list start.,2025-04-10 22:36:51.220248
1337,782,2905,3,Letter lawyer four past collection here.,2025-02-13 00:27:16.840968
1338,12224,4129,2,Law send theory similar so cause human.,2025-03-31 12:02:43.360274
1339,16767,4324,1,Particularly street employee civil while nature visit.,2025-04-04 08:27:57.415654
1340,2705,1267,3,Treat medical actually control side that marriage.,2025-03-25 19:40:08.760770
1341,10209,8,2,Owner central network fact thing.,2025-05-03 17:26:01.268015
1342,14963,1980,4,Walk simple seek service crime foot future.,2025-01-24 12:13:25.977053
1343,1797,1681,1,Listen worker thought task former.,2025-03-20 23:25:44.391195
1344,1083,168,4,Despite rule through surface.,2025-02-03 12:25:20.304362
1345,17601,598,3,Fish lot run relate speak.,2025-01-23 08:58:10.222136
1346,1063,2726,1,Eight challenge staff hope.,2025-04-22 11:56:52.538863
1347,9288,784,3,Moment within task tell someone.,2025-04-10 06:20:06.689597
1348,13370,3225,5,Answer glass environmental sell all morning.,2025-02-16 12:18:19.695986
1349,1190,1559,2,Member drop sure purpose way impact.,2025-02-06 06:55:16.000667
1350,9643,3076,1,Prove Congress order he image focus three.,2025-02-01 18:05:50.017940
1351,14227,1613,1,Sometimes investment production everyone.,2025-05-01 16:54:47.476049
1352,2903,407,4,Discover court evidence officer buy challenge.,2025-03-10 21:56:52.771021
1353,16458,2487,4,Job week oil.,2025-01-27 16:28:28.143157
1354,10830,723,4,Entire name century meeting plan.,2025-03-05 22:57:16.668777
1355,19119,1580,4,Future relate history along.,2025-03-13 03:00:56.652390
1356,5475,3703,3,Away step coach bring would walk age.,2025-02-10 21:13:10.953103
1357,19623,1912,5,Than health admit modern.,2025-04-09 03:08:07.352528
1358,16037,1700,5,Product TV court seat resource some.,2025-03-30 21:17:44.687054
1359,13661,842,5,Senior gas represent offer night everything.,2025-02-14 07:10:33.254917
1360,16151,2546,4,Material friend hospital various cover they.,2025-02-25 23:15:42.019406
1361,19304,3893,4,Term garden cultural necessary yourself.,2025-01-22 19:10:01.205227
1362,12037,1291,4,Special late skin myself safe line.,2025-01-06 00:22:42.678560
1363,3349,2259,3,Figure security approach per.,2025-02-08 14:05:02.732909
1364,14925,4501,5,Other commercial month who company maybe consumer.,2025-04-08 09:42:23.516286
1365,14833,3770,5,Perhaps wonder national window soon even stay.,2025-03-15 18:31:39.386545
1366,3689,1022,3,Blood help cultural.,2025-04-14 13:14:39.263420
1367,8663,2358,5,Else hotel none rate.,2025-02-16 09:14:14.593539
1368,15342,4281,4,Name also such short soldier religious value.,2025-03-17 06:29:28.456073
1369,1405,2108,5,International partner fear region official.,2025-04-05 05:38:01.219163
1370,18936,1010,1,International fact top spend bar speech laugh.,2025-03-24 13:02:42.141607
1371,15650,4092,4,Pay clearly sense claim as vote identify.,2025-02-12 02:41:33.425472
1372,1734,4249,2,Establish former must everyone side.,2025-05-12 10:29:01.269335
1373,9402,2304,4,Medical huge represent.,2025-03-22 13:55:20.275615
1374,15625,3983,2,Town magazine eye weight dream.,2025-01-28 18:03:49.227721
1375,2652,4942,5,Recognize since forward scene everybody.,2025-01-18 16:06:02.877843
1376,19077,488,3,Room western data focus wall before almost.,2025-04-13 16:46:36.039062
1377,8666,2771,5,Girl detail decade visit serious daughter rich.,2025-03-07 10:02:45.464974
1378,12286,1999,1,While thought organization understand world.,2025-01-08 05:59:16.762271
1379,11219,18,4,Threat against over show nice charge friend.,2025-04-24 02:39:26.948355
1380,11607,3608,3,Site special newspaper we themselves goal and special.,2025-03-27 19:06:52.844616
1381,8161,265,5,Company listen draw dinner agency.,2025-03-28 13:48:42.988999
1382,18529,2414,3,Recently turn onto owner.,2025-03-31 13:06:55.351411
1383,6281,750,2,Dog minute somebody west force sea.,2025-02-20 20:40:39.826733
1384,6931,1772,5,Couple without support kitchen.,2025-04-19 10:09:49.231254
1385,1868,367,2,Nearly thousand leader feel.,2025-04-24 08:21:05.375744
1386,3187,1497,5,Fine hundred fine small certain.,2025-01-14 17:01:08.827601
1387,5009,3752,4,Movement raise behind factor result center source.,2025-03-03 09:20:08.527649
1388,14949,3582,1,Happen along western as significant finish last up.,2025-03-25 16:01:32.767084
1389,19822,420,2,Can choice result.,2025-01-03 01:33:45.303222
1390,10005,1849,4,Modern project blood second billion involve perform.,2025-02-01 07:05:14.698766
1391,14344,4514,5,Nature small investment capital no bill.,2025-03-28 12:58:57.865817
1392,15572,1799,1,Sit purpose carry between young fight.,2025-04-25 01:34:11.313668
1393,14861,2977,4,All prove some least.,2025-02-24 14:41:13.137325
1394,17079,4333,3,Size deep experience likely nation.,2025-01-07 19:52:25.996834
1395,7624,3897,5,Skin draw crime trial here recent.,2025-04-06 17:07:33.485126
1396,13647,1302,2,Section little real here.,2025-04-02 09:46:59.672000
1397,5290,4048,1,School general garden.,2025-02-10 17:04:15.641089
1398,14213,1319,3,Interesting appear hold final him.,2025-01-17 19:39:55.644937
1399,17955,3549,1,Option own evidence situation rest.,2025-02-13 05:52:19.662738
1400,7723,3333,5,Task miss organization rich grow.,2025-01-05 23:48:22.595263
1401,12689,3037,2,Situation many positive everybody most table.,2025-03-09 13:34:15.630626
1402,2293,2159,5,On describe amount century.,2025-04-19 18:40:48.300187
1403,11752,4506,3,Glass very end responsibility.,2025-01-22 09:46:03.138908
1404,10377,1715,5,Begin think market many.,2025-05-08 01:14:00.487055
1405,6657,4015,3,Rise special help use western such.,2025-03-23 23:28:17.866430
1406,1529,761,1,Realize image place million wish agency.,2025-03-04 18:04:17.444530
1407,3210,544,2,Again today commercial cold Republican someone hair.,2025-05-11 13:34:58.204725
1408,17647,4613,2,Marriage coach dream election college too.,2025-04-01 19:04:36.800281
1409,11150,4102,5,Least card deal foot.,2025-04-16 22:53:59.513275
1410,8064,2469,3,Market strategy without I say treatment free.,2025-05-03 19:47:43.847253
1411,12154,4977,2,Mr claim history end after manage.,2025-03-20 02:30:59.247597
1412,807,2247,3,Expert shoulder into technology kid.,2025-03-07 07:22:05.265188
1413,9884,1877,4,Contain him human.,2025-04-12 01:10:34.416479
1414,10306,3345,5,Many available door season same.,2025-03-22 16:09:43.628127
1415,175,1653,2,Build certainly meeting study fine then.,2025-05-08 22:51:36.360065
1416,10285,648,3,Share least right man low do individual.,2025-02-01 04:50:39.535824
1417,6368,4450,1,Finally eye every young also full hotel.,2025-02-11 04:16:35.361822
1418,5310,450,2,Week above often describe.,2025-01-17 13:43:17.598958
1419,16955,4418,1,Close bill television leg different tough.,2025-01-28 13:23:09.532938
1420,4485,864,3,Continue nature happen throw beat table moment.,2025-02-26 06:49:31.941901
1421,15058,255,2,Pressure worker color professional necessary lawyer fact bank.,2025-03-22 05:47:26.189285
1422,14795,4814,2,Effect yard and leave.,2025-03-24 16:02:15.096753
1423,10594,2028,3,Ago hit that yet.,2025-05-01 02:20:01.531621
1424,16440,48,2,Glass couple personal total moment organization.,2025-04-26 23:47:27.532272
1425,15589,1981,3,Political win read value before trial.,2025-02-25 07:18:41.273947
1426,6391,2239,3,Great fine scene join toward.,2025-04-16 05:57:35.437339
1427,6105,2818,1,Kind put everything board mother Republican.,2025-03-19 01:46:04.385906
1428,15246,3275,5,Again seat easy hand against simply what.,2025-03-25 06:03:34.153531
1429,15875,790,4,Begin from process Democrat mind else.,2025-01-15 15:35:13.977814
1430,19571,220,1,Rise think cover stock difficult long.,2025-04-13 08:30:31.633735
1431,3400,2285,3,Few interesting music weight.,2025-01-14 23:36:25.438646
1432,1346,2563,4,Science piece quickly three beautiful close stop.,2025-01-06 01:44:08.990645
1433,10988,2952,4,Half month deal natural character.,2025-01-09 13:00:40.857903
1434,16273,4468,3,Newspaper start impact probably beautiful politics be.,2025-05-06 19:39:41.045239
1435,1559,3400,2,Pm sing eight sport.,2025-05-16 22:01:28.206196
1436,15532,2327,4,Bank measure Democrat fire black.,2025-03-12 09:52:30.197778
1437,1552,4766,1,Tax building sea maintain research.,2025-05-05 02:53:56.733501
1438,5643,590,4,Discuss effect lead their fund term hour.,2025-04-27 15:07:56.903219
1439,15976,3168,4,Much agent leg risk defense ahead black.,2025-02-04 01:19:28.805747
1440,17236,1654,2,My central perhaps worry traditional play body.,2025-02-12 22:34:46.710472
1441,1319,1370,2,Home address loss again able full.,2025-02-27 01:32:30.591138
1442,11849,1109,4,Form time card international rock American.,2025-04-20 19:43:05.076089
1443,14109,903,4,Pay benefit single sign.,2025-05-09 11:03:39.594688
1444,3327,1142,4,Off a tonight try believe me argue.,2025-02-22 22:05:29.406159
1445,17942,2586,3,Address do participant example parent seek mouth.,2025-03-27 15:59:30.267691
1446,19471,1199,4,Move skin impact remain.,2025-02-26 10:08:34.279777
1447,18450,3068,4,Half suddenly hundred vote either.,2025-01-13 11:21:39.188585
1448,587,2430,2,Pretty picture should big politics.,2025-05-09 21:26:24.173518
1449,18199,2719,3,Music specific always special perform response way friend.,2025-02-11 04:55:48.002444
1450,7640,3268,5,Particularly above message drug reason one.,2025-04-21 23:18:24.875888
1451,471,1261,2,Foreign school note outside beautiful.,2025-01-15 16:09:11.372702
1452,7935,4243,3,Bag sure upon manager impact on because.,2025-05-03 08:56:20.691482
1453,17056,1120,4,Mr sing woman child whatever table.,2025-04-11 00:14:43.038781
1454,5216,1458,3,Follow and exist happen side.,2025-02-25 07:39:12.810642
1455,7090,3,5,Senior movement reason administration heavy choose.,2025-01-04 21:19:01.060439
1456,1178,4890,3,Few already same me how cover professor.,2025-03-28 15:02:16.080002
1457,5340,4055,2,Pretty none low detail information.,2025-02-05 03:39:39.599169
1458,12175,1087,4,Hand policy draw course team party fast.,2025-05-01 23:56:18.817303
1459,19349,3020,3,Three design institution public fact training.,2025-04-01 15:37:48.410011
1460,10664,4229,4,Specific listen along pressure myself their whose.,2025-02-25 18:02:55.153960
1461,504,256,1,Change though great himself country consider think.,2025-02-22 11:15:32.291109
1462,11447,644,1,Child region stage agent lot language trade.,2025-02-10 22:21:25.099976
1463,3308,1027,5,Talk story music sure gas opportunity.,2025-02-25 00:18:02.451732
1464,8584,4493,1,Ability home home fund reality star clear.,2025-01-10 13:36:40.770191
1465,5405,1192,1,Education section drop might.,2025-03-07 03:03:00.331087
1466,15148,2521,4,Set series professional.,2025-03-11 19:34:18.047428
1467,16362,4775,3,Arrive cost position prevent yard.,2025-02-27 08:15:42.116924
1468,4790,3191,2,Spring too smile.,2025-01-14 13:04:49.476934
1469,12006,1027,1,Tough whatever enjoy politics his daughter population because.,2025-03-11 16:11:31.029227
1470,2800,2494,3,Evidence field behind size party strategy bring.,2025-03-09 07:38:46.736630
1471,6503,4170,1,Stock stage explain front oil.,2025-01-30 23:28:30.570994
1472,32,3141,1,Different road enjoy mission.,2025-01-09 04:55:35.362312
1473,5083,1987,4,Stay his sound per throughout carry evidence.,2025-04-10 06:23:03.098860
1474,1623,4271,1,Seven attorney per send other.,2025-01-24 14:59:30.155504
1475,13795,3659,4,Model shake art four reflect.,2025-03-04 14:15:47.407054
1476,19728,4564,2,Peace turn continue cell worker seek.,2025-01-07 14:31:02.049161
1477,19059,3484,2,Official five all best teacher.,2025-02-08 08:23:08.559600
1478,17740,598,2,People white current American black with able to.,2025-04-17 10:19:06.978255
1479,18321,4206,3,Team economic north.,2025-03-19 15:46:59.794055
1480,3264,4054,1,Product energy movement she.,2025-02-27 00:48:50.925463
1481,4335,2019,2,To third figure education nothing hold computer.,2025-04-25 13:57:41.167563
1482,9541,3876,4,Among impact long start ask.,2025-03-13 15:52:42.718791
1483,1707,1780,3,At drive forget.,2025-02-26 19:59:58.103979
1484,14673,3744,4,Stand hospital PM give will imagine never.,2025-03-22 18:01:11.437816
1485,10598,1530,5,Ground until indicate.,2025-02-05 10:12:15.627681
1486,15103,3990,2,Main soldier culture necessary.,2025-02-27 20:05:51.173570
1487,7175,1166,2,Join particularly return several head movie.,2025-04-22 16:05:57.127137
1488,8681,2180,5,Read class together eye plant.,2025-03-05 07:40:00.021748
1489,13497,3796,2,Speak piece which.,2025-02-27 01:46:45.400670
1490,1867,3073,4,Full management idea figure.,2025-01-30 14:03:37.912673
1491,3841,4296,5,Together pretty employee color security popular wife.,2025-03-31 13:41:06.437228
1492,1254,1658,4,Customer seek truth north lay.,2025-05-09 10:41:32.280036
1493,13113,2107,4,Understand manager out heart.,2025-04-23 00:07:19.123925
1494,4472,2541,4,Prepare forward several.,2025-01-21 00:00:07.702723
1495,10979,4437,2,Word region you serve director message.,2025-01-11 02:43:51.382508
1496,8196,4928,3,Something accept morning heavy throughout strategy.,2025-03-19 16:51:08.858904
1497,19045,4521,1,Result blue staff business continue center bed.,2025-02-01 22:29:45.007629
1498,2816,3796,2,Participant final morning our put.,2025-04-28 14:31:35.703475
1499,1192,4360,5,Between glass store.,2025-05-13 11:06:22.972768
1500,15731,2005,3,Environment inside imagine manager.,2025-04-20 08:30:31.802435
1501,18838,2434,5,Middle state at plant yard.,2025-04-19 18:26:22.035299
1502,7493,1144,2,Mind toward international all difficult.,2025-03-28 21:02:12.466495
1503,19204,1298,3,Get marriage require four decision cultural somebody.,2025-04-19 01:45:30.671700
1504,7860,3439,2,Accept hair room section.,2025-03-20 17:45:41.500556
1505,16799,314,2,Sort should cup nearly keep.,2025-04-20 05:58:41.189785
1506,15532,293,1,Picture party eight them officer high member.,2025-03-15 07:42:55.316484
1507,1896,4941,4,Last recognize lose wife nothing.,2025-04-20 02:37:38.475708
1508,5081,2864,5,Reduce save dream land.,2025-02-20 20:17:59.527205
1509,8692,1409,2,Throughout physical to decision development relationship town.,2025-01-07 03:39:03.421048
1510,598,310,5,Outside both near relationship character every everything.,2025-02-28 17:37:13.415201
1511,17923,1439,3,Car security glass.,2025-03-09 12:43:02.508410
1512,19615,193,5,I discussion imagine between into chance agent.,2025-01-27 04:33:10.375431
1513,12554,971,5,Real machine feeling soldier expect.,2025-03-22 05:16:30.937264
1514,1834,3806,2,Necessary who through.,2025-04-09 08:01:53.246616
1515,16886,2259,2,Majority head throw grow quality wait.,2025-03-21 23:40:14.789903
1516,6358,826,5,Democrat individual use common.,2025-02-17 07:47:39.487304
1517,16575,3626,2,Early audience exactly head not his to language.,2025-05-13 19:46:09.133179
1518,17290,4502,1,Military bill occur edge sell that.,2025-03-25 07:52:17.825519
1519,9807,4308,5,Us sometimes lead student since.,2025-05-04 07:01:28.445132
1520,3751,2831,1,Wife five that growth property tough.,2025-03-25 05:24:52.808668
1521,6751,1677,1,Agent those whom detail player.,2025-01-29 06:46:58.737684
1522,15229,688,5,Above trial want his.,2025-02-02 18:59:09.442913
1523,15147,4137,5,Represent here hit live specific owner project.,2025-04-10 19:41:32.754322
1524,14547,2965,5,Ask reduce three toward debate fight fine.,2025-04-23 04:34:20.038824
1525,16874,4820,5,Develop whatever return current.,2025-01-04 17:49:18.388680
1526,5259,644,5,Forward month build marriage.,2025-01-08 19:41:35.938191
1527,12140,251,2,North record speech baby test thus.,2025-03-03 17:40:53.726813
1528,1756,2457,1,Four nearly word financial.,2025-04-15 20:24:12.799279
1529,9771,3798,5,Charge authority structure success.,2025-04-09 19:48:00.632800
1530,19026,1244,4,Candidate world fear traditional.,2025-05-10 18:19:53.958378
1531,15179,673,1,First enough support report.,2025-03-22 07:20:11.309403
1532,2023,358,5,Cost chance at modern without her while.,2025-03-01 02:36:52.430927
1533,1232,4429,3,Machine hair together color for agree.,2025-03-05 03:32:38.335201
1534,3437,1985,1,Have floor strong they first another.,2025-01-20 07:22:13.396703
1535,10042,3992,3,Minute between hard institution kind world.,2025-01-04 12:29:01.140232
1536,1671,1783,5,Modern generation check claim.,2025-01-09 13:31:35.250325
1537,14194,3876,3,Various walk phone moment.,2025-03-02 22:22:48.843652
1538,4386,3977,3,Keep school sit family.,2025-01-04 23:06:39.768690
1539,15423,1116,3,Either structure still worry four.,2025-04-02 06:23:59.776959
1540,14430,3033,3,Most toward wish sound.,2025-04-16 08:41:18.035818
1541,2652,2371,3,Half total note page while.,2025-02-17 15:35:05.838096
1542,15675,3806,4,Matter keep exactly.,2025-04-12 13:36:17.186215
1543,14679,3151,2,Air realize become suddenly.,2025-03-28 02:15:45.486710
1544,2919,2425,2,Professional onto explain serve watch.,2025-03-13 05:39:18.970721
1545,675,4449,1,Ten bag they see national question.,2025-02-22 00:28:20.239699
1546,11646,1960,3,Hold remain option second name debate.,2025-04-11 06:37:49.982388
1547,10979,2295,4,Single just that arm language behind.,2025-04-16 12:50:15.698771
1548,5148,486,1,Much such heart.,2025-05-04 10:21:45.179575
1549,9840,1714,3,May join step.,2025-02-03 02:41:35.621722
1550,9968,1367,1,Pretty serious better short gun real small.,2025-02-12 10:06:21.201413
1551,14041,2959,4,Hour watch where evening short all into space.,2025-03-06 04:36:46.388515
1552,7980,406,2,Field institution own learn.,2025-03-03 22:05:46.239754
1553,10957,14,4,Skill our level official perhaps goal.,2025-04-15 22:58:30.535125
1554,3930,2917,2,Single hand thousand also political draw.,2025-02-01 01:05:15.172425
1555,5398,1140,2,North successful west take.,2025-03-19 01:17:08.655816
1556,8288,3174,3,Prove sea war.,2025-01-23 21:45:16.814399
1557,6145,4728,1,More may thousand.,2025-01-01 11:48:43.651364
1558,8930,4919,5,Drug task sound stage ago any treat.,2025-01-30 14:12:42.783783
1559,5498,3840,3,Participant learn bit under big poor throughout.,2025-01-22 01:28:38.927803
1560,11753,3359,4,Or car board professor important participant behind.,2025-05-15 14:44:51.560546
1561,12144,315,1,Office here contain this.,2025-03-05 17:15:07.018758
1562,2252,2956,2,War government within this western begin.,2025-04-22 03:21:23.603664
1563,5274,3107,4,Debate part reveal charge skin per.,2025-02-01 19:46:48.864620
1564,13763,2883,5,Enter far news foot.,2025-03-26 00:01:37.917754
1565,8718,3172,1,Who reality business serious.,2025-02-09 07:01:19.360533
1566,10010,4546,1,Travel affect student wife design indicate effort.,2025-04-18 17:02:12.202486
1567,3698,1802,1,Author happen process popular.,2025-01-06 00:09:47.056970
1568,10097,140,3,Also network plan.,2025-03-05 01:58:24.947011
1569,11526,1332,5,Financial economy reality blue himself region character.,2025-03-21 17:59:28.755814
1570,2403,670,2,Address understand bring big college.,2025-01-02 14:49:10.504524
1571,598,1941,4,College surface difficult official bit hotel performance.,2025-03-27 23:43:05.506985
1572,13523,1915,2,Memory sport strong mind life same.,2025-02-14 00:22:34.245925
1573,17147,1025,4,Fact hit none throughout perhaps west.,2025-05-09 12:21:07.546754
1574,10797,2273,5,Mouth hair dog center.,2025-04-06 04:07:58.560320
1575,3262,1814,1,Experience officer imagine he college.,2025-05-05 20:04:14.724545
1576,16330,829,4,Rate while character other always after standard.,2025-04-02 21:54:20.371351
1577,8738,343,1,Others long throw build team Republican turn.,2025-02-06 16:48:19.377287
1578,4539,2814,1,Century knowledge operation art we.,2025-05-16 15:53:56.054609
1579,19800,1319,2,Fund majority song really base.,2025-05-12 10:18:24.420273
1580,13124,137,3,Thing easy perform.,2025-03-21 03:29:00.625888
1581,15555,969,4,Republican citizen role daughter my each radio growth.,2025-03-31 13:31:40.993366
1582,10818,1692,2,Democratic arm partner real town add inside.,2025-04-07 01:44:03.016295
1583,5295,729,4,Party artist right total include president.,2025-01-31 22:08:30.121363
1584,15509,3145,1,Lawyer age west be.,2025-03-01 15:24:29.448596
1585,2307,321,4,Value carry reduce practice eye.,2025-01-05 03:03:11.277234
1586,7115,1299,2,Employee detail outside moment other.,2025-05-02 20:39:01.675900
1587,15019,4638,5,Result authority head mouth admit view report.,2025-03-03 14:42:26.809182
1588,5900,2409,4,Court let maintain either decision laugh.,2025-03-20 14:07:01.895502
1589,11289,2463,5,Successful build simple get student.,2025-03-04 20:34:50.123488
1590,7542,3826,5,Floor or point.,2025-03-12 15:50:27.861701
1591,19938,336,1,Put approach writer feel goal available program.,2025-04-30 17:09:24.151394
1592,1631,2933,5,Meeting part compare tree onto practice.,2025-02-26 20:41:23.776133
1593,10238,1117,3,Today firm finish.,2025-03-02 04:22:58.465141
1594,14140,454,1,Statement field that quickly minute for.,2025-04-12 16:03:32.049442
1595,4023,2560,1,Glass mention south know.,2025-05-08 06:01:25.842592
1596,2891,2071,3,Rock material claim and minute.,2025-02-19 20:52:41.888462
1597,3185,3894,5,Situation despite go hit.,2025-03-07 12:15:21.732035
1598,13909,4288,1,Life they writer country individual this.,2025-02-14 18:38:52.201034
1599,10636,529,1,Draw blue risk edge build risk.,2025-03-26 05:42:57.974815
1600,17904,2799,3,Peace discover two hospital just.,2025-03-27 10:54:29.225955
1601,5701,2880,3,Common area kind other wait continue.,2025-04-15 11:44:47.809057
1602,18452,2396,5,Walk get agreement put.,2025-04-23 05:13:03.228617
1603,1326,4538,1,Ok budget social grow black goal.,2025-03-06 12:01:02.392658
1604,3432,3045,1,Add analysis worry focus production chair agent.,2025-02-26 05:12:57.728827
1605,4030,3058,5,Machine important remain hundred similar main tell into.,2025-03-07 09:37:29.748909
1606,17532,2757,3,Bill become think hospital.,2025-04-16 08:39:17.469547
1607,17665,4039,4,Room point what wish minute send.,2025-01-21 06:48:52.849771
1608,17927,3279,5,Me some care rise role against.,2025-03-30 09:13:31.425356
1609,7822,2309,2,Here also could thing standard administration conference.,2025-01-28 10:32:12.593378
