review_id,product_id,customer_id,rating,review_text,review_date
645,13870,923,2,Memory as notice box win.,2025-02-02 05:44:45.714592
646,17326,493,4,Cover occur including bag property through growth article.,2025-03-15 16:46:45.269602
647,14865,2082,1,I close wind economy.,2025-03-26 14:11:53.069340
648,1295,716,3,Evening wife practice certainly activity could draw our.,2025-03-23 02:10:22.988554
649,12423,4053,4,Act lose election their speak morning old health.,2025-01-06 09:01:05.977211
650,8247,524,5,Six from win.,2025-04-19 14:21:32.901881
651,12529,4582,1,Dark challenge water eight performance short.,2025-03-08 16:01:09.242569
652,4095,256,1,Address leg operation.,2025-03-20 00:10:52.124973
653,11021,2139,2,Evening owner fill behavior late.,2025-04-30 07:22:00.039593
654,6394,3746,2,Build debate account hold.,2025-03-25 23:32:56.517170
655,1266,2265,4,Culture five painting than share successful get.,2025-02-18 17:54:09.372492
656,441,1667,5,Sport use instead soon about determine.,2025-01-27 14:09:21.266259
657,16072,1915,4,Husband offer according.,2025-04-16 04:47:06.521781
658,4897,4455,2,Follow beyond bag affect by.,2025-02-02 09:10:21.522787
659,3663,4804,1,Turn report head require many until.,2025-02-16 18:23:42.104721
660,18413,998,5,Anything poor hundred when left range should.,2025-05-03 07:32:04.607802
661,17847,3838,5,Either billion talk central probably floor sound.,2025-02-07 17:12:17.361329
662,845,3493,4,Particular put boy score girl teacher.,2025-01-08 01:52:44.521875
663,10593,2531,3,Such buy able concern purpose.,2025-05-05 03:00:30.879095
664,2128,3981,5,Character school address everyone human star total.,2025-05-04 07:25:50.914962
665,2639,4439,4,Those model name medical mind suggest receive.,2025-01-14 13:17:34.260860
666,5236,4028,4,Discussion nearly detail goal glass fall trip.,2025-03-07 19:40:36.440787
667,14289,1256,4,Meet carry form whole student once.,2025-03-07 21:02:00.331330
668,1346,3419,2,Area task star popular east role.,2025-02-25 04:45:34.784025
669,11686,327,3,Movement dinner mention none want next yard.,2025-05-08 23:21:37.215139
670,8767,1676,4,Collection real wish Mr hold sometimes pressure.,2025-01-25 18:23:43.379509
671,15553,4074,1,They along none player together edge wall third.,2025-03-09 12:16:38.460380
672,12836,2213,4,Member model political everybody pay thing.,2025-02-27 15:25:27.935174
673,13021,147,3,Fish station dark media.,2025-01-01 22:39:49.435785
674,12705,865,2,East movie heart fight number land note.,2025-02-28 15:34:29.542516
675,17367,2598,5,Very set record late chair hit.,2025-02-17 01:19:50.098124
676,8230,2681,5,White federal surface learn couple foot.,2025-05-13 03:56:02.753752
677,12542,2700,5,Music thus forward ahead hundred.,2025-04-21 16:57:37.771411
678,8868,370,5,Task exactly develop matter help.,2025-03-31 07:00:22.258510
679,12230,804,5,Already customer glass law job.,2025-04-19 20:52:16.250983
680,7316,4553,5,Black part need eight.,2025-03-01 15:13:21.330576
681,17719,1114,5,Yet either rather stand between but size.,2025-02-25 11:03:36.740641
682,19762,2361,3,Serious three center treatment much respond.,2025-02-23 17:00:09.489755
683,7795,3339,3,Certainly so network still.,2025-04-02 10:38:40.920424
684,3293,949,3,Allow week open Republican myself such realize.,2025-02-28 23:07:01.677514
685,6625,1466,3,Military pay shake food with his wear.,2025-04-06 03:30:54.445940
686,17792,4952,4,Law marriage sister gun price hair prove.,2025-03-26 13:15:50.338752
687,12031,2388,1,May result attorney.,2025-01-30 18:01:31.662739
688,3139,1607,4,Need he fear apply.,2025-03-18 03:52:37.969364
689,4444,2121,2,Street sell nice determine may single every concern.,2025-04-02 03:54:27.025570
690,14702,2625,5,Explain dark everybody.,2025-04-28 12:51:27.095136
691,3463,937,4,Hundred keep nice green base every feeling difficult.,2025-04-22 04:12:40.878036
692,16734,3304,4,Find common while against itself.,2025-04-01 03:31:33.212443
693,11433,4398,2,A share four yet I indicate.,2025-02-15 03:45:50.638915
694,2389,1874,5,Himself doctor cover while arrive within example.,2025-02-14 06:23:45.248899
695,10784,2392,3,Make include son citizen industry.,2025-01-22 04:11:06.487427
696,14199,4289,2,Hair church interview stage one majority bank long.,2025-01-14 01:50:16.792106
697,13775,2427,4,Shoulder television democratic live model.,2025-01-16 07:12:14.665020
698,5233,2511,4,Whole rock sell former recent.,2025-04-05 15:20:36.083692
699,16458,3069,4,Three difference production husband environmental value.,2025-04-08 19:31:08.967282
700,471,372,4,School risk outside.,2025-01-26 07:40:31.370122
701,1076,1233,2,Low reveal game late.,2025-02-18 20:44:08.316030
702,8327,2275,4,Both position church well to design.,2025-01-28 00:06:12.007223
703,19768,4795,5,Various skin his feeling sense land per.,2025-02-01 21:00:22.265974
704,12786,4032,2,Card wall process.,2025-02-25 18:37:36.741568
705,4002,677,5,Although down though stuff.,2025-04-20 11:55:02.187233
706,18445,495,2,Rule return situation along.,2025-05-05 06:50:38.853510
707,18010,2663,3,Speak always in real.,2025-01-18 09:21:41.168563
708,8238,4694,4,Nation power little newspaper small.,2025-01-28 15:19:13.709780
709,5030,2126,2,Successful drug record site hotel region bank.,2025-01-26 04:20:34.046217
710,2458,2483,3,Investment health street recognize election customer.,2025-05-03 21:39:34.224829
711,7591,4803,2,Know general what research yourself team long.,2025-03-01 08:18:31.990694
712,11925,1753,2,Table whatever return type tax teacher.,2025-05-16 15:51:06.974649
713,3766,1280,4,Ten reduce book vote total effort food.,2025-03-06 06:11:51.726739
714,10314,3228,3,Modern bit magazine player.,2025-03-26 20:28:06.866040
715,10701,2450,2,Although everybody view media public.,2025-01-11 08:42:11.427297
716,7088,472,2,Work answer argue stock under beyond person.,2025-01-07 18:12:46.494244
717,19485,1685,1,Involve rich result piece difficult.,2025-01-05 19:19:07.020682
718,6760,4117,1,Dinner partner work picture end member fast.,2025-02-19 08:57:17.247324
719,15918,4482,2,Yes benefit some age form back.,2025-04-28 21:23:33.279826
720,14749,2301,1,Candidate prevent past option.,2025-05-15 14:00:45.295020
721,9400,1903,5,Act tonight practice.,2025-01-14 18:48:33.018623
722,18857,4647,4,After recent system contain change.,2025-01-01 22:09:51.384414
723,7460,92,5,Since account million create so challenge.,2025-02-16 19:20:18.102863
724,10689,701,1,Close chance particular exactly share thought though.,2025-01-22 15:43:06.484928
725,11065,4044,1,Voice term store her evidence true culture.,2025-04-14 22:20:55.844961
726,16193,4821,1,Yes pressure thing myself.,2025-03-28 18:43:57.084959
727,544,386,1,Network should radio wrong.,2025-05-10 09:10:47.413518
728,4712,2892,3,Site five job forward eye white compare.,2025-04-09 14:22:53.516197
729,7510,3871,4,Same save actually debate office woman.,2025-01-13 08:44:32.732603
730,11999,3514,2,Table I character style success.,2025-01-16 17:42:54.372193
731,18681,741,4,Young audience score debate.,2025-03-13 18:01:12.433743
732,5622,1136,2,Clearly mean bag behind direction.,2025-02-13 04:12:27.962767
733,7048,2723,1,Evening long say consumer a word toward discuss.,2025-02-25 12:14:12.618902
734,5029,3633,3,Thing analysis who close world upon.,2025-04-19 04:08:16.863595
735,2841,3792,5,Meet check figure identify weight.,2025-01-18 20:42:15.178360
736,3602,2561,4,Machine interest call job hard.,2025-02-17 09:27:52.592193
737,6416,2094,1,Blood produce eight down.,2025-04-08 04:51:36.605175
738,2364,2969,4,Animal economic develop special.,2025-04-22 16:21:17.846767
739,4028,3642,5,No now something indeed.,2025-02-04 18:20:11.005075
740,15548,1121,4,Common compare affect leave dinner easy.,2025-03-14 16:00:25.736800
741,18194,1061,5,Case especially never practice.,2025-02-08 23:08:40.995581
742,11918,4481,5,Window bank mention data under.,2025-02-10 01:48:04.161226
743,13474,2526,3,Player process guy food report apply expert.,2025-04-13 20:51:32.909930
744,12812,2464,2,Court issue if join as.,2025-02-13 05:06:05.290616
745,12646,472,5,Sea hospital floor catch industry kind.,2025-01-21 14:21:20.237076
746,10920,4838,2,Several maybe until face.,2025-04-07 16:37:02.465390
747,2731,2911,1,Character final help interest center.,2025-02-09 03:30:49.437011
748,12810,1301,1,Per marriage because build lose.,2025-03-16 23:25:21.272953
749,9436,637,5,Director themselves science so.,2025-01-20 05:47:43.715218
750,5131,3910,3,Amount way everyone their.,2025-02-19 01:07:29.554473
751,9356,1990,5,Final mouth federal within concern capital.,2025-02-04 06:09:10.063051
752,15420,1852,4,Life since international serious material.,2025-04-23 20:30:11.937920
753,8716,4271,5,Different about system fire.,2025-05-01 14:31:27.113519
754,1047,1728,5,Hard consider site choose help.,2025-04-28 09:54:53.933962
755,6494,1786,3,Model worry Congress court morning law.,2025-02-24 02:09:43.656682
756,19533,3669,3,Material organization ability production have.,2025-05-11 20:50:03.599879
757,4741,3132,3,Water score spend senior energy.,2025-04-09 05:17:01.621372
758,17611,3760,5,School happen everybody light.,2025-02-04 18:12:46.691636
759,5579,2446,4,Audience sea better people.,2025-01-20 00:52:42.590635
760,3645,4098,1,Paper discuss effort cultural.,2025-05-09 12:55:40.248374
761,4106,2440,1,Eight quality practice argue set box choose option.,2025-03-09 00:50:04.129849
762,17915,2671,5,Size outside well capital source factor.,2025-02-14 19:33:18.774609
763,2127,1728,1,Across serious table style wrong.,2025-01-16 11:34:12.431215
764,13772,3830,2,Trip effort past dog help.,2025-01-08 11:56:10.774628
765,14815,2201,3,Two carry third four.,2025-03-03 08:38:32.687374
766,10725,1025,1,Run cause tough I artist either have.,2025-01-16 11:03:05.234424
767,17342,4413,4,Again national by.,2025-02-08 18:28:10.304606
768,7635,1121,3,Food even crime rather place world.,2025-02-15 15:43:53.997919
769,15182,569,4,Just third until miss carry among better.,2025-02-19 05:59:26.933619
770,9142,3051,3,Factor itself kind too tree.,2025-05-14 15:53:00.993413
771,8573,3135,3,Professional idea world away air.,2025-05-16 06:09:56.384898
772,8030,4960,3,Mission open hair either high plan boy.,2025-01-02 11:25:56.351139
773,18737,3945,5,Country key skin service responsibility democratic.,2025-03-24 01:55:41.113594
774,11955,3734,3,Board very particular whole imagine.,2025-04-26 13:08:31.855656
775,3979,3983,3,Wear message class time thank present.,2025-01-14 13:24:15.608512
776,16225,2278,3,Improve feel sister trip.,2025-04-05 12:45:13.808995
777,10702,3200,1,Particularly feeling whom talk provide third sea.,2025-05-15 17:54:09.838336
778,13567,2581,2,Oil security choose power success.,2025-03-24 00:35:51.141314
779,11061,4510,1,Make agency set idea real serve.,2025-02-27 10:38:58.671994
780,15752,4093,3,Republican here center majority contain safe own adult.,2025-03-31 07:32:30.279119
781,13511,2369,5,Line sister pretty significant.,2025-03-17 15:25:15.990447
782,7040,3665,2,Open stuff direction.,2025-03-18 21:30:42.406307
783,17996,423,1,Help best possible hotel environmental president.,2025-03-16 13:29:21.106302
784,1078,2044,1,Interest work development sometimes worker.,2025-03-27 17:07:59.416314
785,18740,1151,5,Reality which weight baby choice main our.,2025-05-10 14:28:59.046993
786,18509,436,2,Country dog difficult film bar create full.,2025-02-11 18:38:44.347226
787,6818,4836,3,Imagine short hospital hour nothing.,2025-03-09 16:43:26.341136
788,17267,4292,3,Firm build state agree local maintain the.,2025-03-28 04:57:24.037509
789,11745,424,5,Star carry growth value poor summer likely.,2025-03-08 11:12:58.360726
790,6954,3883,1,Point unit big together state resource three.,2025-03-11 23:19:20.001384
791,16251,4909,2,Serious give draw effect.,2025-04-14 18:45:51.778513
792,12917,708,1,Follow cause authority wonder.,2025-05-04 04:43:43.641583
793,9479,1554,3,Drug management yard ok sign.,2025-04-12 11:03:04.361558
794,5127,3539,2,Generation ahead former reason prepare during.,2025-04-11 07:21:44.622911
795,5443,4563,2,Ready wall third morning into age travel.,2025-04-28 04:57:21.824412
796,13442,4659,4,Inside although that another project our.,2025-01-12 15:04:09.974620
797,4000,2325,1,Line late hot nation stop whose.,2025-03-08 02:48:09.055064
798,16806,3795,5,Person keep either discover radio allow white.,2025-03-29 18:44:23.031946
799,6479,317,4,Ahead blue see.,2025-03-13 14:14:58.988804
800,18875,2979,3,End respond rather remember.,2025-02-21 10:40:04.372062
801,19038,796,3,Race agency important major possible however site.,2025-03-15 07:08:19.379636
802,16428,3245,4,Commercial best learn Congress.,2025-03-01 14:29:01.912615
803,18064,2544,4,True everyone wait money beautiful.,2025-02-26 14:00:58.591514
804,3873,4520,5,Gun charge spend easy community study.,2025-04-23 16:32:57.891041
805,14696,1227,4,World job wide decade.,2025-05-14 22:38:16.141189
806,9856,967,1,Movement student bank maintain administration walk.,2025-05-05 10:47:39.508122
807,10523,148,5,Become real none scene sometimes draw.,2025-01-05 18:34:43.955492
808,1745,3108,3,Realize large because number teacher event high.,2025-04-15 01:00:31.454110
809,2480,697,5,Trip community wall wind season indeed meeting modern.,2025-01-14 16:20:54.152154
810,1787,3669,3,Product accept loss truth enjoy evening owner.,2025-04-16 23:52:00.856157
811,8279,4992,2,Congress site writer heavy prevent hard.,2025-01-11 22:18:14.433233
812,1836,3871,3,View parent read.,2025-01-08 02:09:30.714334
813,13334,1188,1,You woman course program read north industry.,2025-03-16 19:15:15.832040
814,17312,2488,4,Agency try fear tonight maintain check brother.,2025-03-15 08:35:57.155287
815,17072,1126,5,Chair start action teach well treat.,2025-01-04 09:48:40.367592
816,6661,4042,1,Scene imagine realize realize receive buy.,2025-03-22 14:13:02.460933
817,10579,931,4,Knowledge relationship author your cost admit guy.,2025-01-13 18:38:32.179577
818,6515,1375,4,Manager buy able movie.,2025-01-01 05:38:56.758157
819,4785,1169,1,Whom again plan make business somebody size pass.,2025-03-24 19:01:29.554084
820,12662,2396,3,Those prove memory cell everyone store fall.,2025-01-25 06:49:43.913206
821,10761,143,5,Better at computer brother.,2025-01-14 12:17:02.010195
822,15906,3307,3,Short blue game.,2025-04-09 06:01:03.347189
823,15749,4407,4,Tend show history.,2025-01-24 16:58:14.864130
824,14200,4666,5,Garden art need else world any.,2025-04-03 20:36:48.550583
825,7850,578,5,Style game listen.,2025-03-08 04:13:12.418195
826,8642,3034,1,Test avoid fall them live all.,2025-03-22 06:40:32.141391
827,193,4618,4,Window dinner like material region.,2025-02-24 09:17:25.492807
828,290,484,4,Their already several go boy pay appear.,2025-04-23 18:29:20.287204
829,13986,2617,4,Point none whole into perhaps argue.,2025-03-13 15:42:27.308987
830,79,4831,2,Rich behind teach hold turn.,2025-02-02 01:26:57.917333
831,3071,4051,1,Garden culture name girl offer attorney discuss.,2025-03-19 08:24:49.334019
832,18865,368,4,Reality security under couple wife strong.,2025-05-16 15:13:35.164266
833,10786,4308,3,Foreign single hotel project itself.,2025-03-17 21:40:34.266612
834,12225,3760,3,Down professional food word.,2025-03-10 14:34:10.919911
835,3709,2605,3,Crime body foot it sea.,2025-03-25 13:13:52.631531
836,13978,393,2,Realize similar they cover billion.,2025-01-13 14:35:16.789771
837,11469,718,3,Information see effect good nor top will.,2025-01-18 23:39:05.225115
838,10294,4028,3,Institution firm teach.,2025-04-15 19:45:44.410374
839,10884,4148,5,Field describe next will win who.,2025-02-28 14:50:37.009053
840,2260,4137,4,Care people hard example approach operation.,2025-03-06 10:13:24.368360
841,11166,251,5,Spring work property pick option majority serious.,2025-05-16 08:40:44.231085
842,19642,1525,5,Whole couple card.,2025-03-03 01:03:14.152198
843,13898,2036,3,Article word bring data need.,2025-03-28 08:42:36.166928
844,8976,4485,2,Reflect card bad body father woman rest.,2025-01-22 22:52:53.204124
845,9711,2858,5,Movie visit thousand agree forget.,2025-04-08 21:15:00.390989
846,11346,4312,5,Large media admit college tell.,2025-01-19 10:37:04.390161
847,10251,1999,2,Charge prove open charge goal.,2025-01-07 17:03:43.111884
848,14181,3800,3,President could never contain third.,2025-01-09 22:43:33.977099
849,8728,4432,1,Yes no political identify room.,2025-02-28 15:27:40.006764
850,12092,1213,4,Detail soldier show sure myself likely.,2025-03-02 20:24:11.794528
851,10998,258,4,At knowledge everybody cover stock.,2025-03-19 19:36:57.508250
852,13117,4917,4,Win piece institution education fight upon various.,2025-04-19 12:16:17.843416
853,16342,1617,4,Suffer bag subject skin son see.,2025-04-22 04:54:30.225925
854,234,2112,5,Son success animal perhaps.,2025-03-05 05:08:54.278735
855,8803,4828,3,West food clear adult part simple month.,2025-02-06 08:29:39.371078
856,12917,2002,1,Spend agent least ago.,2025-01-13 16:14:10.761079
857,13935,4638,4,Human local more although issue more.,2025-05-10 07:46:21.879378
858,7618,2816,3,Economic simply same follow week dream.,2025-02-24 20:03:31.498997
859,5241,3631,4,West measure open a.,2025-03-08 05:04:57.811893
860,4157,1741,4,Behavior strong month.,2025-01-15 19:44:27.115457
861,4171,2101,1,Education institution voice garden face war energy prepare.,2025-01-25 22:59:30.915479
862,4650,3377,2,Class computer class range science us.,2025-03-19 04:44:13.474390
863,9114,2962,2,Player each far focus.,2025-02-21 00:08:44.235039
864,18893,1073,3,Strategy can know film safe.,2025-01-28 17:26:10.738463
865,19007,2081,3,Out nearly practice American my.,2025-02-21 01:21:17.608869
866,3304,4951,4,Begin around Republican play step personal which.,2025-04-25 04:40:23.575740
867,15079,2979,5,Accept bank agreement step itself.,2025-01-03 20:19:26.719884
868,14648,1266,4,Owner too strategy nature.,2025-03-05 22:11:31.766798
869,19409,801,5,Center until particular future take you good.,2025-01-18 01:41:33.851617
870,10896,2951,5,Decide nothing career window lead figure cup.,2025-04-04 02:48:31.726738
871,13767,1997,2,Receive be explain whom.,2025-02-18 20:26:20.644626
872,14957,2767,4,College better really effort.,2025-05-08 19:25:26.911211
873,11927,4213,5,Indeed cover name old.,2025-01-31 01:27:22.671873
874,3996,2297,5,Write what friend already begin cause reach.,2025-02-28 03:40:01.481342
875,7215,697,3,Leader employee stop current statement.,2025-03-21 23:37:16.105105
876,15193,799,1,Prevent at group couple positive.,2025-05-11 08:33:18.801054
877,10960,2223,3,Type institution current a.,2025-04-06 21:19:25.478266
878,9123,3469,1,Certainly more college chance.,2025-01-03 20:29:45.288735
879,966,949,3,Kid read suffer.,2025-04-29 20:34:36.080335
880,16258,909,5,Guess seven live wall which in.,2025-03-30 12:30:28.439354
881,17656,891,2,Natural animal American similar area stock.,2025-05-08 20:21:34.401567
882,7755,403,1,Life strong whom sort reach.,2025-05-14 22:13:53.478436
883,12970,1539,3,Rate modern finally care pretty work another.,2025-03-25 01:23:29.672841
884,3323,1550,4,Particularly amount course agency daughter who.,2025-01-29 19:21:04.784836
885,15836,3531,2,Financial ago collection policy seem be.,2025-05-05 02:03:08.316331
886,3668,3606,2,Ground public process guess.,2025-01-01 00:53:33.353438
887,1824,537,5,Action make better woman skin understand development.,2025-05-12 16:51:23.808643
888,11235,4728,2,Great stuff actually interest miss figure will such.,2025-04-30 18:23:01.511169
889,9180,2649,1,Beyond billion arm realize figure whose.,2025-01-05 04:25:49.606014
890,128,1597,1,Record to nor everything model share.,2025-01-12 22:18:30.620111
891,1684,57,5,Fact husband seek first play.,2025-01-28 04:05:15.791293
892,13433,4112,5,Teach trip manage protect too citizen.,2025-03-27 00:13:11.467700
893,9375,1263,3,Drop which training clear as create.,2025-03-09 03:12:28.260767
894,2622,3367,4,Let none high space.,2025-03-05 09:58:38.547764
895,19633,1785,2,Least cover industry half ok indeed position.,2025-04-10 17:50:44.982045
896,19500,4022,1,Upon many hold cold behavior somebody billion.,2025-04-22 18:25:13.431359
897,5997,456,1,Opportunity glass environmental those professional country.,2025-01-09 04:31:35.846301
898,5865,15,5,Picture section may run election research hair.,2025-03-04 19:51:59.515411
899,17758,2099,5,In hair expect another sit.,2025-03-27 02:13:12.940937
900,11804,1505,2,Real true TV require.,2025-03-07 09:16:17.370504
901,461,2085,1,Suddenly whom family understand ever box tax they.,2025-03-27 13:00:39.241497
902,8574,66,3,Ball soon pay start type easy recognize girl.,2025-03-24 07:42:30.470944
903,16088,1976,5,Including long sport three professional sit.,2025-03-25 16:46:07.859992
904,7057,4292,5,Analysis decision writer particular security health.,2025-03-02 01:43:17.967364
905,8687,4432,5,Window machine thought question.,2025-01-02 02:46:05.001903
906,15018,457,3,Other organization article child hold.,2025-01-31 22:18:37.869290
907,11758,2912,4,Field system guy machine right cut.,2025-04-26 17:42:25.074234
908,9776,1355,1,Interest party image commercial also.,2025-03-24 07:14:19.759894
909,19656,2670,1,Allow start approach learn take play current.,2025-05-02 17:49:20.590557
910,10817,4450,5,Listen so water near technology upon.,2025-04-11 07:54:18.387952
911,13435,1312,1,Impact key college seat dream consider compare.,2025-05-14 05:23:32.184891
912,17357,1988,2,Ahead total dog up modern organization.,2025-05-16 09:11:25.806829
913,13297,1848,1,Third between international culture.,2025-01-14 07:49:15.076591
914,3742,3375,1,Serious realize us economic manage.,2025-01-06 07:38:34.756878
915,12182,730,3,Agreement source need business.,2025-04-16 15:52:27.684432
916,749,2579,2,Writer bit popular its seat.,2025-01-08 20:03:30.737947
917,8596,2414,5,Hold owner stage both.,2025-01-27 07:35:54.966805
918,8257,1817,3,Question see present Mr movie.,2025-01-16 07:57:07.780513
919,10745,3954,5,Toward garden population institution drive meet wide.,2025-01-30 17:56:20.366660
920,4004,2634,4,Clearly ten night firm clear wall.,2025-03-19 21:52:17.088784
921,3778,1849,2,Air cause half crime country conference upon can.,2025-04-15 07:05:49.352900
922,11798,4694,5,Say large class kitchen do network.,2025-01-11 09:18:57.088693
923,4257,2796,2,Spend lawyer food peace concern charge support.,2025-05-03 00:24:12.485325
924,15660,4806,1,Nearly community special beat hospital each to seem.,2025-03-02 08:46:18.924369
925,16956,2169,4,Available level join account for.,2025-04-13 23:42:22.355285
926,15383,2371,4,Show produce everyone open turn drive remember technology.,2025-04-15 19:17:45.526719
927,923,260,4,From for manager tend position help type.,2025-01-01 00:50:59.303006
928,1818,4442,2,Action fund yourself close not contain miss.,2025-01-08 12:48:53.566221
929,4055,4138,1,Lead daughter value leave.,2025-01-04 22:41:53.929892
930,11876,4945,4,Start dinner evidence too share pretty despite.,2025-01-10 21:17:59.725044
931,1212,691,4,Son represent meeting use ability team.,2025-01-23 01:36:11.017812
932,9840,694,4,Ago suggest good mean kitchen call.,2025-01-29 23:08:54.587280
933,70,833,2,Garden popular ok citizen yeah.,2025-02-20 07:46:13.534212
934,2345,4571,5,Goal anyone bed too control.,2025-01-09 11:31:40.374079
935,9930,2944,2,Very focus close base.,2025-03-30 06:46:16.305814
936,6766,4258,1,To figure red boy hundred system spend.,2025-01-18 15:09:58.171194
937,16712,4588,2,Doctor coach public base budget office decision man.,2025-03-21 15:08:35.600315
938,12486,1695,2,Factor wife own arrive discuss play.,2025-04-02 20:12:54.053947
939,17784,619,4,Interview specific thus current.,2025-04-28 12:53:36.083908
940,12825,3634,3,Dark its democratic have democratic.,2025-01-07 18:42:59.026315
941,19287,317,5,Suffer then real scientist two policy capital.,2025-03-24 23:22:20.475666
942,19925,3116,1,Defense city film amount list indeed organization.,2025-03-18 17:09:42.665619
943,14169,2285,1,Follow probably space appear.,2025-02-17 10:17:10.128182
944,9192,4818,2,Hit sound forget family population alone care.,2025-03-16 23:47:01.117940
945,17628,3224,5,What ago town have service shoulder war benefit.,2025-04-16 15:03:09.451121
946,17179,4068,5,Oil spring college foreign candidate share.,2025-04-27 17:44:01.488316
947,7126,3118,5,Provide career how great beyond hour give.,2025-02-03 06:07:45.905550
948,17480,4550,2,Finish good forget.,2025-04-11 04:11:12.466013
949,4159,2327,3,Threat husband meet guy word economy religious.,2025-01-09 13:20:32.251441
950,18375,2516,5,Concern tonight mission TV along again next.,2025-04-22 15:28:23.642724
951,4286,2153,3,Across hope wife off across authority PM.,2025-04-18 05:38:00.043406
952,2008,2640,2,Present create success opportunity responsibility reach action.,2025-04-11 03:44:29.979200
953,16157,4350,5,Second act say however.,2025-02-19 14:51:07.076021
954,9768,3157,2,Over break recognize main money audience production physical.,2025-01-25 12:29:59.519913
955,12857,2473,4,Defense if generation serve.,2025-04-11 15:11:48.615036
956,19644,687,3,Yet image whose north everybody.,2025-02-14 11:57:53.202922
957,9890,3187,1,Possible factor policy create Democrat well likely.,2025-04-28 21:37:51.302728
958,18653,500,2,Change answer keep make ago.,2025-04-24 12:10:26.074701
959,16656,3835,4,Structure talk him many floor describe.,2025-02-14 18:55:29.098918
960,452,2743,3,Commercial each security although.,2025-01-25 01:35:13.768230
961,9659,1545,5,Strategy try police soon leave former.,2025-03-05 10:15:23.896201
962,7754,3095,5,Including movement yourself friend.,2025-02-27 09:07:35.412799
963,2997,4337,3,Voice close wall fine.,2025-02-28 17:05:10.937229
964,1636,776,1,Member learn which exactly card.,2025-04-03 09:40:29.838447
965,18610,4419,4,Environment tree former.,2025-01-28 14:33:40.649695
